a76a0e8e5e99b82158ee3e092d8b544a,Valmir de Souza,Giro Inclusivo e Biomob,biovalmir@gmail.com,,https://www.facebook.com/giroinclusivo.biomob?fref=ts,SP,São Paulo (SP),Rio de Janeiro,"Não, mas uma das principais iniciativas da organização trata do tema",2010,Ideologia,Arquitetura e urbanismo,,,,,,,Saúde e qualidade de vida,Acessibilidade,,,,,,Nacional,,,,,Empresa,Valmir de Souza,Masculino,,49,Superior,Integral,3,9,,Remunerados parcialmente,,25,5,,,Doação direta (Investimento social/filantrópico),,,Financiamento coletivo (crowdfunding),,,Patrocínio (investimento empresarial),,,,,,Assessoria de Imprensa,,,Facebook,,Jornal,,,Revista,Site,,Twitter,,,Arquitetura da edificação [interface entre espaço público e lote privado; projeto na infraestrutura para mobilidade a pé],,,"Infraestrutura local [calçadas, cruzamentos, escadarias, passarelas, passagens subterrâneas, travessias, sinalização, mobiliário urbano]",,"Microacessibilidade ao Transporte Público Coletivo [conectividade, intermodalidade]","Planejamento e desenho urbano [uso e ocupação do solo, infraestrutura de transporte, planejamento na escala do bairro/cidade]","Saúde e Qualidade de Vida [sedentarismo e doenças relacionadas, como obesidade, diabetes; problemas respiratórios; estresse e depressão]",,,,,"Educação e Cultura [disseminação, capacitação, intervenção artística, sensibilização]",,,,,,,Mutirões de acessibilidade e passeios,Projeto em tramite na Fapesp,,,Ausência / escassez de recursos / financiamento,,,Escassez de parcerias,,,,,,,Coleto meus próprios dados em campo,,IBGE,"Jornais, Revistas, Sites, Blogs",,"Mídias Sociais (Facebook, Twitter, Medium)",,,,Apoio financeiro,,,,Parceria para ações,,Parceria para campanhas,,,,Secretaria da pessoa com deficiência e cvi,"Cidades a pé, corrida amiga, sampa pé, caminha rio",As mesmas,Ajudar a formatar um estatuto do pedestre ,2016-05-02 20:22:43,2016-05-02 20:45:13,46917ba64e
07399c9c6bec2f7b0f75d72331b7e0b8,Mauricio,Diverte Inverte,mau.mms@gmail.com,,https://www.facebook.com/diverteinverte/?fref=ts,SC,Joinville (SC),,"Não, mas uma das principais iniciativas da organização trata do tema",2014,"Grupo de amigos que atua de maneira independente nos momentos livres. Utilizamos o espaço público para construir experiências, promover micro-transformações e momentos de convívio. Replicamos algumas intervenções urbanas na cidade de Joinville",,,,,,,,,"Intervenções Urbanas, Arte, Design, Experiencia, Mobilidade, Smart Cities",Bairro / comunidade,Cidade,,,,,,Coletivo,,Coletivo,,,,,,,,0,4,,,Não remunerados,4,0,,,,,,,,,,,,,Nenhuma fonte de financiamento,,,,,Facebook,,,,,,,,,,,,Bicicleta [convívio entre mobilidade cicloviária e mobilidade a pé],,,,,,,,,,,,"Intervenção física no espaço [obra civil, intervenções temporárias, artísticas]",,,,,,Edição da intervenção Urbana Walk Your City na cidade de Joinville,"Inspirar, gerar reflexão e diversão no dia das pessoas na cidade",,,Ausência / escassez de recursos / financiamento,,,,Escassez de voluntários,,,,,,,,,"Jornais, Revistas, Sites, Blogs",,"Mídias Sociais (Facebook, Twitter, Medium)",,,,,Apoio institucional,,,,,,,,Jornal e TV,"SOCIESC com convite na semana academica de Arquitetura e Urbanismo, Canais de TV e Jornais Locais na divulgação das ações","Se Joinville Fosse Nossa, Inova Joinville","Cidade Democratica, Connected Smart Cities, ",,2016-05-02 21:13:44,2016-05-02 21:27:33,6f858d6e45
ecfa998b761766015b425f1d9a29f0c7,Silvia Ballan,silviaenina.org,silviaenina@gmail.com,http://silviaenina.org/,https://www.facebook.com/silviaenina/?fref=ts,SP,São Paulo (SP),,"Não, mas uma das principais iniciativas da organização trata do tema",2009,Incentivar as pessoas a usar o modal bicicleta ou qualquer modal de transporte ativo. Nosso objetivo é incentivar sempre e conquistar apoio financeiro.,,Comunicação,,Educação,,Meio ambiente,,Saúde e qualidade de vida,mobilidade urbana,Bairro / comunidade,Cidade,Regiões Metropolitanas (várias cidades),Estado,Vários Estados / Regional,Nacional,Internacional,Movimento Social,,Não formalizado,,,Feminino,,,,Parcial,2,2,,,Não remunerados,2,2,,,,,,,,,,,,,Nenhuma fonte de financiamento,,,,E-mail / mailing / newsletter,Facebook,,,,,,Site,,Twitter,YouTube,,,Bicicleta [convívio entre mobilidade cicloviária e mobilidade a pé],,"Infraestrutura local [calçadas, cruzamentos, escadarias, passarelas, passagens subterrâneas, travessias, sinalização, mobiliário urbano]","Meio ambiente e sustentabilidade [mudanças climáticas, energia, emissão de gases, poluição, economia sustentável]",,,"Saúde e Qualidade de Vida [sedentarismo e doenças relacionadas, como obesidade, diabetes; problemas respiratórios; estresse e depressão]",,,,,,,,"Mobilização [ativismo, participação, engajamento e controle social]",,,,Caminho da escola com crianças. Respeito aos idosos nas calçadas e espaços publicos em geral,,,,,,,,,,,,,patrocinio,Coleto meus próprios dados em campo,,,,,"Mídias Sociais (Facebook, Twitter, Medium)",Pesquisa Origem e Destino,,,,,,,Parceria para ações,,,,,,"Aromeiazero, Bike Anjo, Ciclocidade e CicloBR","CorridaAmiga, Sampapé e minha sampa",Cidade a pé,,2016-05-03 00:59:10,2016-05-03 01:08:42,646b4b6641
0e7ec1737c1bb6644ab77c2c9602fb48,Mauro,Caminhadas Urbanas,maurocalliari@uol.com.br,http://sao-paulo.estadao.com.br/blogs/caminhadas-urbanas/,,SP,São Paulo (SP),,Sim,2013,Reflexões sobre as caminhadas na cidade.,,,,,,,,,,,Cidade,,,,,,,Blog,,,,,,,,,,,,,,,,,,,,,,,,,,Trabalho voluntário,,,,,,,,,Jornal,,,,,,,,,,,,,,,,,,,Aspectos sensoriais da caminhada,"Comunicação e Informação [produção e compartilhamento: sites, blogs, grupos de discussão virtual]",,,,,,,,Andar. Escrever. ,,,,,,,,,,,,,Não tenho dificuldades para falar de caminhadas. Todo mundo parece gostar desse assunto.,Coleto meus próprios dados em campo,,,,,,,,,,,,,,,,,Não possuímos ações em parceria,Solidariedade e apoio emocional.,"ANTP, Cidade a pé, FAU USP, FAU Mackenzie, Conselho Participativo, Conselho de Política Urbana.",,ANTP. Cidade a pé.,"Força aí, pessoal!",2016-05-03 12:28:31,2016-05-03 12:33:55,9b488eeb62
9684b296943f6e591ad6c64f1ac281ff,Ronaldo,Pedestre-se,roniduarteproerd@gmail.com,,https://www.facebook.com/Pedestre-Se-830380870416636/?fref=ts,ES,Vitória (ES),Vila Velha,"Não, mas uma das principais iniciativas da organização trata do tema",2015,"Debater e criar alternativas para amenizar os problemas de mobilidade urbana, valorizar os meios não poluidores no transporte, o correto uso das vias públicas, o respeito às regras de trânsito e sobre tudo, com o pedestre.",,,,,,,Políticas públicas,,,,,Regiões Metropolitanas (várias cidades),,,,,Movimento Social,,Movimento Social,,Ronaldo Duarte Barrozo,Masculino,,50,Ensino superior incompleto,Parcial,0,1,,,Não remunerados,2,4,,,,,,,,,,,Trabalho voluntário,,,,,,,Facebook,,,,,,,,,,,,,,"Infraestrutura local [calçadas, cruzamentos, escadarias, passarelas, passagens subterrâneas, travessias, sinalização, mobiliário urbano]",,,,,,,,"Comunicação e Informação [produção e compartilhamento: sites, blogs, grupos de discussão virtual]",,,,,,,,Proposição de ideias sobe o correto uso do espaço público de vias. ,"Fomentar o interesse popular pelo tema, trazer a discussão o correto uso do espaço público",,,,,,,,Falta de colaboradores,,,,,,,,"Jornais, Revistas, Sites, Blogs",,,,,,,,,,,,,,Não possuímos ações em parceria,,,não,corrida amiga,,2016-05-03 12:34:53,2016-05-03 12:39:04,9b488eeb62
3c1199342d457bc3374b24bf121eace8,André Gonçalves,Sobreurbana,andre@sobreurbana.com,http://sobreurbana.com/,https://www.facebook.com/Sobreurbana/?fref=ts,GO,Goiânia (GO),,"Não, a mobilidade a pé é apenas um dos temas abordados, mas aparece sempre em um contexto mais amplo",2013,"Somos um estúdio de intervenções urbanas e culturais. Trabalhamos de forma inovadora e criativa com artistas, empreendedores, governo, ONGs e iniciativa privada para melhorar a experiência das pessoas nos espaços públicos da cidade e promover melhores ambientes.
Nossa Visão:
Cidades pensadas à escala humana, sustentáveis e resilientes, com qualidade de vida e boa urbanidade.
Nossa Missão:
Promover a cultura urbana e melhorar a experiência das pessoas nas cidades através da ativação dos espaços públicos e sua adequação às dinâmicas da vida social.",Arquitetura e urbanismo,,,,,,,,,Bairro / comunidade,,,,,,,,Estúdio,Empresa,,André,Masculino,,41,Graduação,Integral,,,,Remunerados parcialmente,,0,15,,,,,Edital,Financiamento coletivo (crowdfunding),,,Patrocínio (investimento empresarial),Prestação de serviço,,,Nenhuma fonte de financiamento,,Assessoria de Imprensa,Congressos e Seminários,E-mail / mailing / newsletter,Facebook,,Jornal,Publicação científica,,,Site,,,YouTube,,,Bicicleta [convívio entre mobilidade cicloviária e mobilidade a pé],,"Infraestrutura local [calçadas, cruzamentos, escadarias, passarelas, passagens subterrâneas, travessias, sinalização, mobiliário urbano]","Meio ambiente e sustentabilidade [mudanças climáticas, energia, emissão de gases, poluição, economia sustentável]",,,,,,,"Comunicação e Informação [produção e compartilhamento: sites, blogs, grupos de discussão virtual]",,"Intervenção física no espaço [obra civil, intervenções temporárias, artísticas]",,"Mobilização [ativismo, participação, engajamento e controle social]",,,,"Construção de parklets, Jane's Walks, oficinas e ações sobre caminhabilidade","Oficinas de mobiliários urbano, intervenções urbanas no espaço público",,,Ausência / escassez de recursos / financiamento,,,,,,,,,,Coleto meus próprios dados em campo,,,"Jornais, Revistas, Sites, Blogs",Legislação,"Mídias Sociais (Facebook, Twitter, Medium)",,Trabalhos acadêmicos,,,Apoio institucional,,,Parceria para ações,"Parceria para aprendizagem, capacitação ou treinamento",Parceria para campanhas,Parceria para mobilização e sensibilização,,,"Bike Anjo, Coletivo Centopeia, GoType, Festival Bananada, Sinduscon GO, Sebrae, ANTP, Laboratório da Cidade, Instituto Mobilidade Verde, Cidades paraPessoas",,"Instituto Mobilidade Verde, Sampa a pé, Mobilize",,2016-05-03 15:28:46,2016-05-03 15:47:47,e89aab3ac3
3fd56630ddfeb4fd7e321e8ff2568841,Alberto Rodrigues Camargo,Caminhada das QUEBRADAS,albertosagaz@hotmail.com,,https://www.facebook.com/caminhadadasquebradas/?fref=ts,SP,São Paulo (SP),Não há,Sim,2013,"Conscientizar as pessoas para uma pratica de atividade física e hábitos saudáveis, sociabilizar e conhecer a geografia local que chamamos de valorização Regional.",,,,Educação,,,Políticas públicas,,,Bairro / comunidade,,,,,,,Movimento Social,,Movimento Social,,Alberto Rodrigues Camargo e ou Shirley Neves Oliveira,Masculino,,31,Pós-Graduado,Integral,2,2,,,Não remunerados,5,1,,,,,,,,,Patrocínio (investimento empresarial),,,Venda de produtos,,,,,,Facebook,,,,,,,,,,,,,,"Infraestrutura local [calçadas, cruzamentos, escadarias, passarelas, passagens subterrâneas, travessias, sinalização, mobiliário urbano]",,,,"Saúde e Qualidade de Vida [sedentarismo e doenças relacionadas, como obesidade, diabetes; problemas respiratórios; estresse e depressão]",,,,,"Educação e Cultura [disseminação, capacitação, intervenção artística, sensibilização]","Intervenção física no espaço [obra civil, intervenções temporárias, artísticas]",,"Mobilização [ativismo, participação, engajamento e controle social]",,,,"Realizamos 4 vezes ao ano a Caminhada das QUEBRADAS (bairros), na Zona Leste de SP, onde sempre o percurso é de uma bairro para outro. que tem como objetivo principal a conscientização, a sociabilização e a valorização regional",Temos parceria com o Movimento Cultural da Região denominado Movimento Cultural de Ermelino Matarazzo,,Apoio político,Ausência / escassez de recursos / financiamento,,,Escassez de parcerias,,Falta de colaboradores,,,,,,,,"Jornais, Revistas, Sites, Blogs",,"Mídias Sociais (Facebook, Twitter, Medium)",,Trabalhos acadêmicos,,Apoio financeiro,,,,,,,Parceria para mobilização e sensibilização,,,Movimento Cultural de Ermelino Matarazzo que engloba vários coletivos.,Desbravadores de Sampa,Organizações que atuam em prol da Caminhada e corrida de RUA,Gostaria de agradecer a Silvia que nos encontrou no facebook e nos possibilitou o preenchimento deste formulário. Deixo como sugestão: vcs tentarem ajudar na Divulgação de todos os eventos direcionados pra essa finalidade da mobilidade a pé. com mais notoriedade fica mais fácil conseguir recursos para realizar os eventos. Obrigado! E que de tudo certo pra todos nós nas nossas caminhadas.,2016-05-03 16:28:26,2016-05-03 17:02:40,d30b40559a
f7f8e4b9e0ef88c93dab61314f5d007e,Erika Mota,Soluções para Cidades/ ABCP,erika.mota@abcp.org.br,http://www.solucoesparacidades.org.br,https://www.facebook.com/Institutosolucoes/?fref=ts,SP,São Paulo (SP),Fortaleza; Recife; Salvador; Brasília; Campo Grande; Rio de Janeiro; Vitória; Belo Horizonte; Curitiba; Florianópolis; Porto Alegre,"Não, mas uma das principais iniciativas da organização trata do tema",1936,"A organização foi fundada em 1936,  Programa Soluções para Cidades em 2010. O Soluções para Cidades é um programa de apoio aos municípios, que tem o objetivo de acelerar e qualificar o desenvolvimento urbano, através de projetos, parcerias e transmissão de conhecimento aos administradores municipais e demais atores urbanos.

O foco de nosso trabalho está no desenvolvimento das áreas de Habitação, Saneamento, Mobilidade e Espaços Públicos.

O Programa promove o uso de soluções a base de cimento, apoiado em uma plataforma que congrega ferramentas de apoio e capacitação a técnicos e gestores públicos, articulação dos atores envolvidos na dinâmica urbana e sistematização e divulgação de práticas que possam inspirar novos modelos de desenvolvimento.",Arquitetura e urbanismo,,,,Engenharia ,,Políticas públicas,,,Bairro / comunidade,Cidade,Regiões Metropolitanas (várias cidades),Estado,,Nacional,,Associação,,Instituto,,Erika Mota,Feminino,,39,Engenheira civil graduada pela Universidade Estadual Paulista (UNESP). Pós-graduada em Marketing pela Escola Superior de Propaganda e Marketing (ESPM) e especialista em gestão públicas pela Fundação Getúlio Vargas (FGV),Integral,1,25,,Remunerados parcialmente,Não remunerados,5,,,,,Doação direta (membros associados),,,,,,,,,,,Assessoria de Imprensa,Congressos e Seminários,E-mail / mailing / newsletter,Facebook,,,,,Revista,Site,,,,Liga - rede social da construção civil,Arquitetura da edificação [interface entre espaço público e lote privado; projeto na infraestrutura para mobilidade a pé],Bicicleta [convívio entre mobilidade cicloviária e mobilidade a pé],Economia [impactos da mobilidade na economia; geração de emprego; análise de trade-off; fomento ao comércio local],"Infraestrutura local [calçadas, cruzamentos, escadarias, passarelas, passagens subterrâneas, travessias, sinalização, mobiliário urbano]","Meio ambiente e sustentabilidade [mudanças climáticas, energia, emissão de gases, poluição, economia sustentável]",,"Planejamento e desenho urbano [uso e ocupação do solo, infraestrutura de transporte, planejamento na escala do bairro/cidade]",,"Segurança [pessoal, viária e acidentalidade vertical]",,,"Comunicação e Informação [produção e compartilhamento: sites, blogs, grupos de discussão virtual]","Educação e Cultura [disseminação, capacitação, intervenção artística, sensibilização]","Intervenção física no espaço [obra civil, intervenções temporárias, artísticas]","Legislação e Políticas Públicas [produção e revisão de leis, planos e programas relacionados à mobilidade a pé]","Mobilização [ativismo, participação, engajamento e controle social]",,,,"capacitação a técnicos e gestores públicos;
articulação dos atores envolvidos na dinâmica urbana; sistematização e divulgação de práticas que possam inspirar novos modelos de desenvolvimento;
produção de conteúdo (cartilhas, manuais...);
apoio ao desenvolvimento e execução de novas tecnologias (pavimentos permeáveis, fotocatalíticos...)","Mobilidade Cicloviária e Alternativa:
Seminários/Mesas Redondas/ Concurso  - Cidades Cicláveis
Espaços Públicos:
Capacitações e Manual: Diagnóstico e Projetos de Espaços Públicos
Transporte Público Coletivo:
Capacitação e assistência técnica na execução de BRTs, Corredores urbanos e Terminais.",,,Ausência / escassez de recursos / financiamento,,,,,,,Falta de planejamento estratégico,,,,Dados municipais abertos,,,Legislação,,,,,,Apoio institucional,Apoio político,Parceria para pesquisas,Parceria para ações,"Parceria para aprendizagem, capacitação ou treinamento",,Parceria para mobilização e sensibilização,,,FIRJAN (25 municípios da Baixada Fluminense); Senai RJ; SEBRAE RJ; Câmara Metropolitana de Integração Governamental do Rio de Janeiro; ITDP; ANTP; Codivap(40 municípios parceiros); Associação de Engenheiros e Arquitetos de São José dos Campos;  PMSP; Instituto Horizontes; SEBRAE MG; PMCuritiba; IPPUC; ANFRI; Cidade a Pé; WRI/Embarq,Cidade a Pé; Corrida Amiga; Mobilize; Instituto Mobilidade Verde; USP Cidades; ITDP; Cidade Ativa; Rede Nossa São Paulo; WRI/Embarq ,ITDP; WRI; ANTP,,2016-05-04 17:13:23,2016-05-04 18:03:20,7c4fee7a9b
3a14aa375f6bfc9afd35e68a35facc01,Mila Guedes,Milalá - A Liberdade de Ir e Vir,mila@milaguedes.com.br,http://milala.com.br,https://www.facebook.com/milala.com.br/?ref=ts&fref=ts&qsefr=1,SP,São Paulo (SP),,"Não, mas uma das principais iniciativas da organização trata do tema",2013,"Milalá é uma organização que trabalha para fortalecer os direitos humanos das pessoas com deficiência direcionada à divulgação, conscientização e aprofundamento dos direitos individuais, coletivos e inclusão social, a promoção da ética, da paz, da cidadania, dos direitos humanos, da democracia e de outros valores universais; sugestão, acompanhamento  e fortalecimento de políticas de conscientização das dificuldades de acesso das pessoas com deficiência. Milalá funciona como ponto de encontro digital para a elaboração de pareceres e análises de lugares acessíveis que possam receber pessoas com deficiência, estimulando-as a passear, viajar,  participar da vida cotidiana e exercer os seus direitos. ",,Comunicação,Direito,,,,,Saúde e qualidade de vida,,,Cidade,,Estado,,Nacional,,Organização Social (OS),,Organização da Sociedade Civil de Interesse Público (OSCIP),,Mila Guedes,Feminino,,47,Superior completo,Integral,2,0,,,Não remunerados,0,2,,,,,,,,,,,,,Nenhuma fonte de financiamento,,,,,Facebook,,,,,,Site,,,YouTube,Instagram,,,,"Infraestrutura local [calçadas, cruzamentos, escadarias, passarelas, passagens subterrâneas, travessias, sinalização, mobiliário urbano]",,,,,,,,"Comunicação e Informação [produção e compartilhamento: sites, blogs, grupos de discussão virtual]","Educação e Cultura [disseminação, capacitação, intervenção artística, sensibilização]",,,"Mobilização [ativismo, participação, engajamento e controle social]",,,,Envolvimento e engajamento junto aos Grupos de Trabalho de Mobilidade a Pé.,Campanha Caçada Cilada/Campanha Calçadas do Brasil,,Apoio político,Ausência / escassez de recursos / financiamento,,,,,,,,,,Coleto meus próprios dados em campo,Dados municipais abertos,IBGE,"Jornais, Revistas, Sites, Blogs",Legislação,"Mídias Sociais (Facebook, Twitter, Medium)",Pesquisa Origem e Destino,Trabalhos acadêmicos,,,,,,Parceria para ações,"Parceria para aprendizagem, capacitação ou treinamento",Parceria para campanhas,Parceria para mobilização e sensibilização,,,"Comissão Técnica de Mobilidade a Pé e Acessibilidade da ANTP, Corrida Amiga, Pé de Igualdade, Cidade a Pé, SampaPé, Cidade Ativa e Mobilize.","Comissão Técnica de Mobilidade a Pé e Acessibilidade da ANTP, Corrida Amiga, Pé de Igualdade, Cidade a Pé, SampaPé, Cidade Ativa e Mobilize.","Comissão Técnica de Mobilidade a Pé e Acessibilidade da ANTP, Corrida Amiga, Pé de Igualdade,Cidade a Pé, SampaPé, Cidade Ativa e Mobilize.",Quero sempre andar junto com vcs!,2016-05-05 22:49:46,2016-05-06 00:04:48,b8d85f3cee
5522ef487a8c0f42db492a26135f4524,Dimitre Gallego,PingPoint,info@pingpoint.com.br,http://www.pingpoint.com.br,https://www.facebook.com/pingpointsocial/?fref=ts,SP,São Paulo (SP),,"Não, a mobilidade a pé é apenas um dos temas abordados, mas aparece sempre em um contexto mais amplo",2014,"O PingPoint tem como objetivo promover o uso do espaço público, a interação social, a saúde, a arte e o lazer por meio da instalação de mesas de pingue-pongue permanentes.",Arquitetura e urbanismo,,,,,,,Saúde e qualidade de vida,,Bairro / comunidade,Cidade,,,,,,Empresa,,Empresa,,Dimitre Gallego,Masculino,,36,Arquiteto e Urbanista,Parcial,,,,,,,,,,,,,Financiamento coletivo (crowdfunding),,,,,,Venda de produtos,Nenhuma fonte de financiamento,,,,E-mail / mailing / newsletter,Facebook,,,,,,,,,,,,,,"Infraestrutura local [calçadas, cruzamentos, escadarias, passarelas, passagens subterrâneas, travessias, sinalização, mobiliário urbano]",,,,,,,,,,"Intervenção física no espaço [obra civil, intervenções temporárias, artísticas]",,,,,,,,,,,,,,,,,,,,,,,,,,,,,,,,,,,,,,,,,,,2016-05-05 23:42:34,2016-05-06 11:50:19,fc8c54e0a3
d9a3086b8afe946a5fabe2801538ba92,Tiago Martinelli,Parqueleta,parqueleta@gmail.com,,https://www.facebook.com/parqueleta/?fref=ts,SP,São Paulo (SP),,"Não, a mobilidade a pé é apenas um dos temas abordados, mas aparece sempre em um contexto mais amplo",2015,"Acreditamos no potencial de convívio e interação das pessoas nas cidades e vemos que a iniciativa da criação de parklets favorece na proposição de pequenas áreas de convivência para as pessoas.

Essas instalações pontuais ainda tem a qualidade de questionar o tipo de uso que damos aos espaços públicos, retirando o espaço de um carro estacionado para a criação de um local de convívio para várias pessoas.

Pensando nisso, desenvolvemos um sistema indrustrializado de parklet, diminuindo custos de instalação e montagem, mas mantendo flexibilidade de customização, composto por peças de concreto, aço e madeira - que denominamos de Parqueleta - afim de ampliar e democratizar ainda mais as instalações desses espaços na cidade.
",Arquitetura e urbanismo,,,,,,,,,Bairro / comunidade,,,,,,,,Parceria entre o coletivo oitentaedois e a marcenaria Farpa,,Parceria,,,,,,,5,,,Remunerados parcialmente,,,,,,,,,,,,,,,Venda de produtos,,,,,,Facebook,,,,,,,,,,,,Bicicleta [convívio entre mobilidade cicloviária e mobilidade a pé],,"Infraestrutura local [calçadas, cruzamentos, escadarias, passarelas, passagens subterrâneas, travessias, sinalização, mobiliário urbano]",,,,,,,,,,"Intervenção física no espaço [obra civil, intervenções temporárias, artísticas]",,,,,,"A mobilidade a pé se insere indiretamente em nossa organização.

O fato dos parklets serem instalações junto às calçadas, com bicicletários - entre outros equipamentos -, se relacionam com pedestres por serem os principais usuários desses espaços e da escala dos parklets ser voltada principalmente a eles.",,,,,,,,,,Falta de conhecimento / clareza sobre o tema,,,,,,,"Jornais, Revistas, Sites, Blogs",,"Mídias Sociais (Facebook, Twitter, Medium)",,,,,,,,,,,,Não possuímos ações em parceria,,,,,,2016-05-05 20:40:15,2016-05-06 17:34:01,0a525681d4
37f04d57f8cd547204f42de205446828,Hugo,Desbravadores de Sampa,desbravadoresdesampa@gmail.com,http://www.desbravadoresdesampa.com.br/,https://www.facebook.com/desbravadoresdesp/?fref=ts,SP,São Paulo (SP),,"Não, a mobilidade a pé é apenas um dos temas abordados, mas aparece sempre em um contexto mais amplo",2011,"A contemplação da cidade, abertura a novos conhecimentos e consequente quebra de paradigmas.",,,,,,,,,Diversos,,Cidade,,,,,,Coletivo,,Coletivo,,Hugo Peroni,Masculino,,35,Programador visual,Parcial,,3,,,Não remunerados,3,7,,,,Doação direta (membros associados),,,,,,,,,,,,,,Facebook,,,,,,Site,,Twitter,YouTube,,Arquitetura da edificação [interface entre espaço público e lote privado; projeto na infraestrutura para mobilidade a pé],,,,"Meio ambiente e sustentabilidade [mudanças climáticas, energia, emissão de gases, poluição, economia sustentável]",,,"Saúde e Qualidade de Vida [sedentarismo e doenças relacionadas, como obesidade, diabetes; problemas respiratórios; estresse e depressão]",,,,"Comunicação e Informação [produção e compartilhamento: sites, blogs, grupos de discussão virtual]",,,,,"Pesquisa [diagnóstico, caracterização, indicadores]",,,"Diretamente nenhuma. Utilizamos as vias para realizar nosso objetivo principal que é correr e contemplar a cidade. Assim, os participantes testam a utilização das calçadas e decidem por conta própria se passarão as utilizar como vias de deslocamento.",,,,Ausência / escassez de recursos / financiamento,,Capacitação da equipe,,,,,Falta de planejamento estratégico,,,,,,,,"Mídias Sociais (Facebook, Twitter, Medium)",,Trabalhos acadêmicos,,,Apoio institucional,,,Parceria para ações,,,,,,Corrida Amiga,"Sim. Corrida Amiga, cidade ativa, Sampapé",Corrida amiga,Sim. É preciso criar constantemente campanhas de conscientização tanto de motoristas como de caminhantes para o momento do cruzamento das ruas e faixas de pedestres. ,2016-05-07 13:25:10,2016-05-07 13:39:40,4086d4fb0f
