ce0666f16a0b47280241e75451b630de,caio esteves,places for us,caio@placesforus.com.br,http://www.placesforus.com.br,https://www.facebook.com/placesforus/?fref=ts,SP,São Paulo (SP),,"Não, mas uma das principais iniciativas da organização trata do tema",2015,transformação urbana e social,,,,,,,,,Place Branding e Public Diplomacy,Bairro / comunidade,Cidade,Regiões Metropolitanas (várias cidades),Estado,Vários Estados / Regional,Nacional,,,Agência,,agência com certificação B Corp pending,Caio Esteves,Masculino,,44,"arquiteto, MBA Branding",Integral,4,2,Remunerados integralmente,,,5,,,,,,,,,,,,,,,prestação de serviço,,Congressos e Seminários,,Facebook,LinkedIn,,Publicação científica,,,Site,,Twitter,,,Arquitetura da edificação [interface entre espaço público e lote privado; projeto na infraestrutura para mobilidade a pé],Bicicleta [convívio entre mobilidade cicloviária e mobilidade a pé],Economia [impactos da mobilidade na economia; geração de emprego; análise de trade-off; fomento ao comércio local],,,,"Planejamento e desenho urbano [uso e ocupação do solo, infraestrutura de transporte, planejamento na escala do bairro/cidade]","Saúde e Qualidade de Vida [sedentarismo e doenças relacionadas, como obesidade, diabetes; problemas respiratórios; estresse e depressão]",,"Tecnologia e Inovação [aplicativos, rede e plataforma online, base de dados]",,"Comunicação e Informação [produção e compartilhamento: sites, blogs, grupos de discussão virtual]",,,,,,"Projetos e Planos [projetos de arquitetura, desenho urbano, planos de mobilidade, diretores]",,Inclusão da discussão nos planos de city branding e place branding.,"advocacy pela qualidade dos espaços públicos, advocacy pela identidade das cidades",,,,,,,,,,,,,Coleto meus próprios dados em campo,Dados municipais abertos,,"Jornais, Revistas, Sites, Blogs",,"Mídias Sociais (Facebook, Twitter, Medium)",,Trabalhos acadêmicos,,,,,,Parceria para ações,,,,,,Cidade ativa,cidade ativa,,,2016-06-28 13:59:20,2016-06-28 14:09:07,bcd11737bf
87fdce4989dd473493b51b04bd9e9901,Rony William Pereira,Prefeitura Municipal São José dos Campos - ST - Scretaria de Transportes -Programa Calçada Segura,calcadasegura@sjc.sp.gov.br  ,http://www.sjc.sp.gov.br/calcadasegura,,SP,São José dos Campos (SP),,,2010,"O Programa Calçada Segura da Prefeitura de São José dos Campos foi criado no ano de 2010, para incentivar e servir de apoio na implantação e adequação dos passeios da cidade. 

Para a condução dos trabalhos do Programa, foi necessária regulamentar uma Lei Municipal que estabelecesse os critérios de manutenção e execução de calçadas e passeios da cidade. 

A Lei Municipal 8077/2010, foi criada em conjunto as Secretarias Municipais e as entidade que, de alguma forma, relacionavam-se com o tema de calçadas, pedestres e acessibilidade. 

Essa Lei, ainda em vigor, apresenta os parâmetros técnicos e determinam padrões e normas arquitetônicas das calçadas, bem como determina prazos de adequação e encaminhamentos. 

O Programa de calçadas da cidade usou as seguintes ações e estratégias: 

- Ação Educativa – Trata-se de uma equipe de idosos (acima de 60 anos) que visitam as casas, cadastram a calçada e fazem abordagens com os moradores, distribuindo material educativo que orienta a execução ou manutenção da calçada nos padrões da Lei Municipal. 

- Ação Orientação Técnica – Trata-se de uma equipe de profissionais técnicos que orientam os moradores “no local” a correta execução ou manutenção da calçada, bem como orientam os projetos dos Engenheiros e Arquitetos. 

- Ação de Fiscalização – O Programa Calçada Segura em parceria com Fiscalização, notifica os proprietários dos imóveis para a adequação das calçadas. 

Perceba-se que o ato de fiscalização somente acontece após a ação educativa e a orientação técnica. Sendo assim, quando a pessoa é notificada, a mesma já teve a oportunidade de ser conscientizada pela ação educativa e já recebeu todas as informações técnicas para a correta execução. 

Durante o processo do desenvolvimento do Programa, também foi gerado um inventário das calçadas que pertencem a Prefeitura (UBS, Escolas, Esporte e todos os outros prédios Municipais), criando com isso uma agenda de adequação das calçadas os equipamentos municipais. 

Durante as adequações das calçadas, percebemos que a cidade estava com falta de mão de obra especializada na execução ou manutenção específica de passeios, conforme os padrões de acessibilidade, pois com a multiplicação das ações educativas os munícipes se motivaram para reformarem suas calçadas, sendo por notificação ou voluntariamente. 



2


Na sequência o Programa criou outro braço de ação “o Treinamento e Atendimento aos executores de Calçadas”, criando uma parceria com o Senai e a ABCP – Associação Brasileira de Cimentos Portland fornecendo Cursos de Calceteiros com parte teórica e prática, formando aproximadamente 300 pessoas que no decorrer do processo, deixaram de trabalhar sozinhas e começaram a se agrupar criando cooperativas e micro empresas de execução de calçadas e reformas em geral, hoje temos 15 empresas atendendo nosso município, com essa ação foi gerado o lado de empreendedorismo do Programa, pois muitos acharam uma profissão e formaram empresas prestadoras serviços de calçadas para a população. 

O amadurecimento do conceito, condicionou que todas as legalizações de imóveis (habite-se, ampliação, pequenas reformas e alvarás de funcionamento) tenham a suas calçadas no padrão de segurança dos pedestres. 

Atualmente o Programa evoluiu no conceito da mobilidade a pé, ampliando a visão do pedestre, apoiando e conjugando os outros modais da mobilidade, desenvolvendo seus trabalhos na Secretaria de Transportes do município. 
",Arquitetura e urbanismo,,,Educação,Engenharia ,,Políticas públicas,,,,Cidade,,,,,,Orgão Público,,Orgão Público,,Rony William Pereira,Masculino,,40,Administração,Integral,,3,Remunerados integralmente,,,3,,,,,,,,,Orçamento Público,,,,,,,,Congressos e Seminários,,,,Jornal,,,,Site,,,,,Arquitetura da edificação [interface entre espaço público e lote privado; projeto na infraestrutura para mobilidade a pé],Bicicleta [convívio entre mobilidade cicloviária e mobilidade a pé],,"Infraestrutura local [calçadas, cruzamentos, escadarias, passarelas, passagens subterrâneas, travessias, sinalização, mobiliário urbano]",,,"Planejamento e desenho urbano [uso e ocupação do solo, infraestrutura de transporte, planejamento na escala do bairro/cidade]",,,,,,,"Intervenção física no espaço [obra civil, intervenções temporárias, artísticas]","Legislação e Políticas Públicas [produção e revisão de leis, planos e programas relacionados à mobilidade a pé]",,,"Projetos e Planos [projetos de arquitetura, desenho urbano, planos de mobilidade, diretores]",,Regulamentar de forma fiscalizadora e educativa o tema de calçadas no município de São José dos Campos,Acessibilidade em edificações.,Acesso a informações,,,,Capacitação da equipe,Escassez de parcerias,,Falta de colaboradores,,,,,Coleto meus próprios dados em campo,Dados municipais abertos,IBGE,,Legislação,,,,,,Apoio institucional,Apoio político,,,"Parceria para aprendizagem, capacitação ou treinamento",,Parceria para mobilização e sensibilização,,,ABCP - Assoaciação Brasileira de Cimentos Portland - ANTP - Associação Nacional de Transportes Públicos ,,ANTP ,"É muito importante realizar um inventário dos Projetos e Ações de acessibilidade aos pedestres, bem como elaborar um cardápio atualizado para divulgação e conhecimento dos órgãos que trabalham o tema.",2016-06-28 14:27:16,2016-06-28 14:52:07,3ee7420921
d05277022837fa3aece87a304777ebc5,Renato Ozorio ,Via trolebus ,renatoozoriomkt@gmail.com,http://viatrolebus.com.br,http://Facebook.com/viatrolebus,SP,São Paulo (SP),,"Não, a mobilidade a pé é apenas um dos temas abordados, mas aparece sempre em um contexto mais amplo",2003,Paixão pelo tema,,Comunicação,,,,,,,,,,,,Vários Estados / Regional,,,,Site,,Site,Renato Ozorio ,Masculino,,31,Marketing ,Integral,2,2,,,Não remunerados,3,1,,,,,,,,,,,,,Nenhuma fonte de financiamento,,Assessoria de Imprensa,,E-mail / mailing / newsletter,Facebook,,Jornal,Publicação científica,,,,,Twitter,,,,Bicicleta [convívio entre mobilidade cicloviária e mobilidade a pé],,"Infraestrutura local [calçadas, cruzamentos, escadarias, passarelas, passagens subterrâneas, travessias, sinalização, mobiliário urbano]",,"Microacessibilidade ao Transporte Público Coletivo [conectividade, intermodalidade]",,,,,,"Comunicação e Informação [produção e compartilhamento: sites, blogs, grupos de discussão virtual]","Educação e Cultura [disseminação, capacitação, intervenção artística, sensibilização]","Intervenção física no espaço [obra civil, intervenções temporárias, artísticas]",,,,,,Sessão no site dedicado ao tema,,Acesso a informações,,,,,,,,,,,,,,,,,,,,,,,,,,,,Parceria para mobilização e sensibilização,,,,,,,2016-06-28 14:56:39,2016-06-28 15:11:37,c5fc43b3c1
9e6eb31cee0a855dda8da3c0923b7f07,mariana,cidades sem fronteiras,mariana@marianabarros.com.br,http://bit.ly/marianabarros,http://www.facebook.com/cidadessemfronteiras,SP,São Paulo (SP),,"Não, a mobilidade a pé é apenas um dos temas abordados, mas aparece sempre em um contexto mais amplo",2014,"A cada mês, cinco milhões de pessoas trocam o campo pelo asfalto. Ao final do século seremos a única espécie totalmente urbana do planeta. O Cidades sem Fronteiras é uma plataforma para debater os desafios dessa histórica transformação.",Arquitetura e urbanismo,Comunicação,,,Engenharia ,Meio ambiente,Políticas públicas,Saúde e qualidade de vida,,,,Regiões Metropolitanas (várias cidades),,,Nacional,Internacional,,Plataforma de comunicação,Não formalizado,,Mariana Barros,Feminino,,34,Pós-graduação,Parcial,,,,,,,,,,,,,,,,,Prestação de serviço,,,,,,,,Facebook,LinkedIn,,,,Revista,Site,,Twitter,,,Arquitetura da edificação [interface entre espaço público e lote privado; projeto na infraestrutura para mobilidade a pé],,Economia [impactos da mobilidade na economia; geração de emprego; análise de trade-off; fomento ao comércio local],,,,"Planejamento e desenho urbano [uso e ocupação do solo, infraestrutura de transporte, planejamento na escala do bairro/cidade]",,,,,"Comunicação e Informação [produção e compartilhamento: sites, blogs, grupos de discussão virtual]",,,,,,,,Incentivar o debate sobre o tema,"Organização e divulgação de eventos, campanhas e conteúdos relacionados",,,Ausência / escassez de recursos / financiamento,,,,,Falta de colaboradores,,,,,,,,"Jornais, Revistas, Sites, Blogs",,"Mídias Sociais (Facebook, Twitter, Medium)",,Trabalhos acadêmicos,,,,,,,,Parceria para campanhas,Parceria para mobilização e sensibilização,,,"CorridaAmiga, Urb-i, ANTP, Associação Parque Minhocão",,,,2016-06-28 15:19:59,2016-06-28 15:38:04,630804fde2
e4d1ef6b2d5010711d28d560bb20c4fa,Ubiratan Leal,Outra Cidade,redacao@outracidade.com.br,http://outracidade.com.br,http://facebook.com/umaoutracidade,SP,São Paulo (SP),,"Não, mas uma das principais iniciativas da organização trata do tema",2015,Promover uma vida melhor nas cidades,,Comunicação,,,,,,,,Bairro / comunidade,Cidade,Regiões Metropolitanas (várias cidades),,,,,,Veículo de comunicação,,Veículo de comunicação,Ubiratan Leal,Masculino,,38,Jornalista,Integral,1,10,Remunerados integralmente,Remunerados parcialmente,,5,5,,,,,,,,,Patrocínio (investimento empresarial),,,,,,,,E-mail / mailing / newsletter,Facebook,,,,,,Site,,Twitter,,,Arquitetura da edificação [interface entre espaço público e lote privado; projeto na infraestrutura para mobilidade a pé],Bicicleta [convívio entre mobilidade cicloviária e mobilidade a pé],Economia [impactos da mobilidade na economia; geração de emprego; análise de trade-off; fomento ao comércio local],"Infraestrutura local [calçadas, cruzamentos, escadarias, passarelas, passagens subterrâneas, travessias, sinalização, mobiliário urbano]","Meio ambiente e sustentabilidade [mudanças climáticas, energia, emissão de gases, poluição, economia sustentável]","Microacessibilidade ao Transporte Público Coletivo [conectividade, intermodalidade]","Planejamento e desenho urbano [uso e ocupação do solo, infraestrutura de transporte, planejamento na escala do bairro/cidade]","Saúde e Qualidade de Vida [sedentarismo e doenças relacionadas, como obesidade, diabetes; problemas respiratórios; estresse e depressão]","Segurança [pessoal, viária e acidentalidade vertical]","Tecnologia e Inovação [aplicativos, rede e plataforma online, base de dados]",,"Comunicação e Informação [produção e compartilhamento: sites, blogs, grupos de discussão virtual]",,,,,,,,Elaborar reportagens para ajudar o público a entender melhor o que envolve esse tema.,,Acesso a informações,,,,,Escassez de parcerias,,,,,,,Coleto meus próprios dados em campo,Dados municipais abertos,,"Jornais, Revistas, Sites, Blogs",,"Mídias Sociais (Facebook, Twitter, Medium)",,,,Apoio financeiro,Apoio institucional,,,,,Parceria para campanhas,,,,,"Cidade Ativa, Sampa a Pé",Cidade Ativa,,2016-06-28 16:14:40,2016-06-28 16:25:12,973238d686
8ea9894ce18f59f551182aab73eb96d5,Daniella,Colab.re,daniella.almeida@colab.re,http://colab.re,http://facebook.com/colab.re,SP,São Paulo (SP),"Nosso escritório fica em São Paulo, mas o Colab atua em mais de 100 municípios do Brasil. Alguns deles: Campinas; Santos; Niterói; Teresina; Recife; PortoAlegre; Salvador; Curitiba; Juiz de Fora; ","Não, mas uma das principais iniciativas da organização trata do tema",2013,A idéia de construir gestões municipais colaborativas e cidadãs!,,,,,,,Políticas públicas,,,,Cidade,,,,,,Empresa,,Empresa,,Bruno Aracaty,Masculino,,30,Administração de Empresas,Integral,17,0,Remunerados integralmente,,,1,0,,,,,,,,,Patrocínio (investimento empresarial),,,Venda de produtos,,,Assessoria de Imprensa,,E-mail / mailing / newsletter,Facebook,LinkedIn,Jornal,,,Revista,,,Twitter,YouTube,,,,,,,,,,,"Tecnologia e Inovação [aplicativos, rede e plataforma online, base de dados]",,,,,,,"Pesquisa [diagnóstico, caracterização, indicadores]",,,,,,,,,,,,,,,Interesse das lideranças da organização,,Coleto meus próprios dados em campo,,,,,"Mídias Sociais (Facebook, Twitter, Medium)",,,,,,,,Parceria para ações,,,,,,Comunitas,,,,2016-06-28 17:08:21,2016-06-28 17:16:17,31756b8ca4
46543f00aa0422cb0214ac65a769367e,Reny da Silva Vera,COMISSÃO ESPECÍFICA PERMANENTE DE CALÇADAS - CEPC,arquitetareny.veras@gmail.com,,,RO,Porto Velho (RO),,Sim,2011,"Regulamentar as situações transitórias que envolvem aprovação e execução de projeto de calçadas, garantindo acessibilidade e mobilidade a todos os munícipes",,,,,,,Políticas públicas,,,,Cidade,,,,,,Comissão,,Comissão,,Reny da Silva Vera,Feminino,,45,Arquiteta e Urbanista,Integral,9,0,Remunerados integralmente,,,0,5,,,,,,,,Orçamento Público,,,,,,,,,,,,,,,,,,,,Audiências Públicas,,,,"Infraestrutura local [calçadas, cruzamentos, escadarias, passarelas, passagens subterrâneas, travessias, sinalização, mobiliário urbano]",,,,,,,,,,"Intervenção física no espaço [obra civil, intervenções temporárias, artísticas]","Legislação e Políticas Públicas [produção e revisão de leis, planos e programas relacionados à mobilidade a pé]",,,"Projetos e Planos [projetos de arquitetura, desenho urbano, planos de mobilidade, diretores]",,Padronização de Calçadas.,Integração do transporte coletivo urbano,,,,Burocracia / meios legais de atuar,,,,,,,,Clima,,,,,Legislação,"Mídias Sociais (Facebook, Twitter, Medium)",Pesquisa Origem e Destino,,,,Apoio institucional,Apoio político,,Parceria para ações,,,,,"Acadêmica, Ministério Público","Ministério Público, Faculdades, Rede Amazônica de Telvisão )Rede Globo).",não,não sabemos,Efetue uma pesquisa com mais profundidade na região norte do Brasil (Porto Velho - Rondônia).,2016-06-28 18:15:12,2016-06-28 18:37:35,e24de3f064
699a76a0f057e906a83e3f12fd9906d7,Mariana Koury,Centro de Criação de Imagem Popular,mariana.cecip@gmail.com,http://www.cecip.org.br,http://facebook.com/cecip,RJ,Rio de Janeiro (RJ),,"Não, a mobilidade a pé é apenas um dos temas abordados, mas aparece sempre em um contexto mais amplo",1986,"Contribuir para o fortalecimento da cidadania, produzindo informações e metodologias que influenciem políticas públicas promotoras de direitos fundamentais.",Arquitetura e urbanismo,,,Educação,,,Políticas públicas,Saúde e qualidade de vida,,Bairro / comunidade,Cidade,Regiões Metropolitanas (várias cidades),,,,,Organização Social (OS),,Organização Social (OS),,,,,,,,,,Remunerados integralmente,,,,,,,,,Edital,,,,,,,,,,Assessoria de Imprensa,Congressos e Seminários,E-mail / mailing / newsletter,Facebook,,Jornal,Publicação científica,Rádio,Revista,Site,TV,,,,,,,"Infraestrutura local [calçadas, cruzamentos, escadarias, passarelas, passagens subterrâneas, travessias, sinalização, mobiliário urbano]",,,"Planejamento e desenho urbano [uso e ocupação do solo, infraestrutura de transporte, planejamento na escala do bairro/cidade]",,,,,,,,,"Mobilização [ativismo, participação, engajamento e controle social]","Pesquisa [diagnóstico, caracterização, indicadores]","Projetos e Planos [projetos de arquitetura, desenho urbano, planos de mobilidade, diretores]",,"Discussão com crianças sobre os desafios dos seus caminhos de casa para escola e busca de solução com elas sobre como melhorar esses caminhos, facilitando sua circulação a pé. ",,,Apoio político,Ausência / escassez de recursos / financiamento,,Capacitação da equipe,Escassez de parcerias,,,,,,,Coleto meus próprios dados em campo,Dados municipais abertos,IBGE,"Jornais, Revistas, Sites, Blogs",,"Mídias Sociais (Facebook, Twitter, Medium)",Pesquisa Origem e Destino,Trabalhos acadêmicos,,Apoio financeiro,Apoio institucional,,Parceria para pesquisas,Parceria para ações,"Parceria para aprendizagem, capacitação ou treinamento",,Parceria para mobilização e sensibilização,,,,Instituto de Políticas de Transporte & Desenvolvimento,"Instituto de Políticas de Transporte & Desenvolvimento, CriaCidade,  Apé Mobilidade",,2016-06-28 16:02:11,2016-06-28 19:01:02,7632e86870
143087d2a8fb59b9f4bd72558721438d,Patrícia Ribeiro,Blog Passeios Baratos em SP,contato@passeiosbaratosemsp.com.br,http://passeiosbaratosemsp.com.br/,http://www.facebook.com/Passeiosbaratosemsp/,SP,,São Paulo,"Não, a mobilidade a pé é apenas um dos temas abordados, mas aparece sempre em um contexto mais amplo",2015,"Os objetivos do blog

- divulgar as atrações da cidade e chamar atenção para a beleza, riqueza histórica e áreas verdes que cercam a metrópole;

- educar a população para consumir cultura e valorizar os atrativos da cidade, os monumentos, parques e patrimônio histórico;valorizar o que São Paulo tem de melhor;

- Oferecer dicas sobre os lugares mais visitados, aqueles menos conhecidos e uma agenda cultural do que está acontecendo na cidade com preços populares ou gratuitos;

- incentivar as pessoas a passearem pela cidade com o olhar do turista, descobrir detalhes na arquitetura, fazer passeios alternativos, visitar pontos turísticos e fazer programas culturais em família;

- fomentar a economia criativa, negócios inovadores (economia solidária, meios de hospedagem alternativos e mobilidade urbana);

- promover passeios a pé pela cidade (walking tours) e de ecoturismo.",,Comunicação,,Educação,,,,Saúde e qualidade de vida,,,Cidade,Regiões Metropolitanas (várias cidades),Estado,,,,,Blog/ internet,Não formalizado,,Patrícia Ribeiro,Feminino,,46,Pós-graduação,Integral,0,3,,,Não remunerados,0,3,,,,,,,,,,Prestação de serviço,,,,,Assessoria de Imprensa,,E-mail / mailing / newsletter,Facebook,LinkedIn,,,,,Site,,Twitter,,,,,,,,,,,,,organizo passeios culturais a pé pela cidade,"Comunicação e Informação [produção e compartilhamento: sites, blogs, grupos de discussão virtual]",,,,,,,,"Promover passeios culturais a pé pela cidade, escrever sobre lugares para fazer caminhadas, trilhas, parques e áreas verdes na cidade e incentivar passear a pé pela cidade para conhecer a história e o patrimônio cultural","divulgar as atrações da cidade e chamar atenção para a beleza, riqueza histórica e áreas verdes que cercam a metrópole;

- educar a população para consumir cultura e valorizar os atrativos da cidade, os monumentos, parques e patrimônio histórico;valorizar o que São Paulo tem de melhor;

- Oferecer dicas sobre os lugares mais visitados, aqueles menos conhecidos e uma agenda cultural do que está acontecendo na cidade com preços populares ou gratuitos;

- incentivar as pessoas a passearem pela cidade com o olhar do turista, descobrir detalhes na arquitetura, fazer passeios alternativos, visitar pontos turísticos e fazer programas culturais em família;

- fomentar a economia criativa, negócios inovadores (economia solidária, meios de hospedagem alternativos e mobilidade urbana);",,,Ausência / escassez de recursos / financiamento,,,Escassez de parcerias,,Falta de colaboradores,,,,,,,,"Jornais, Revistas, Sites, Blogs",,"Mídias Sociais (Facebook, Twitter, Medium)",,,,,,,,,,,,Não possuímos ações em parceria,,,Não,"Mobilize, Cidade a pé, Cidade Ativa",Não,2016-06-28 19:14:40,2016-06-28 19:27:08,d9bf530ed1
b967c78ae1102fd807ed35d26e78c53b,Belisa,Micrópolis,contato@micropolis.com.br,http://micropolis.com.br,http://www.facebook.com/coletivomicropolis/?fref=ts,MG,Belo Horizonte (MG),,"Não, a mobilidade a pé é apenas um dos temas abordados, mas aparece sempre em um contexto mais amplo",2010,"Estudar as práticas urbanas e propor ações, projetos e discussões.",Arquitetura e urbanismo,,,Educação,,,,,,Bairro / comunidade,Cidade,,,,,,Coletivo,,Empresa,,Não tem,,Não há um coordenador,1,"Arquitetos, urbanistas e cientistas políticos",Integral,7,0,Remunerados integralmente,,,5,10,,,,,Edital,,Leis de incentivo (ex. Lei de incentivo ao esporte),,,Prestação de serviço,,,,,,,E-mail / mailing / newsletter,Facebook,,,,,,Site,,,,,Arquitetura da edificação [interface entre espaço público e lote privado; projeto na infraestrutura para mobilidade a pé],,,"Infraestrutura local [calçadas, cruzamentos, escadarias, passarelas, passagens subterrâneas, travessias, sinalização, mobiliário urbano]",,,"Planejamento e desenho urbano [uso e ocupação do solo, infraestrutura de transporte, planejamento na escala do bairro/cidade]",,,,,"Comunicação e Informação [produção e compartilhamento: sites, blogs, grupos de discussão virtual]","Educação e Cultura [disseminação, capacitação, intervenção artística, sensibilização]",,,,"Pesquisa [diagnóstico, caracterização, indicadores]","Projetos e Planos [projetos de arquitetura, desenho urbano, planos de mobilidade, diretores]",,Estudos urbanos considerando aqueles que circulam a pé.,"São também, mobilidade pela bicicleta, transporte público e privado.",Acesso a informações,,,,,,,,,,,,Coleto meus próprios dados em campo,Dados municipais abertos,IBGE,"Jornais, Revistas, Sites, Blogs",Legislação,,,,,,,,Parceria para pesquisas,Parceria para ações,,,,,,"Piseagrama, Instituto C.A.S.A., Oi Kabum, JACA, CEU Jardim dos Pequis, parcerias individuais","BHTrans, Tarifa Zero",Sampapé,Fazer pesquisas voltadas para as pessoas que transitam a pé.,2016-06-28 12:07:26,2016-06-29 14:05:12,3ce13c24b9
404af0dee6ac817ed3614ae062fee35c,Roberto speicys,Scipopulis,fale@scipopulis.com,http://www.scipopulis.com,https://www.facebook.com/appcoletivo,SP,São Paulo (SP),,"Não, a mobilidade a pé é apenas um dos temas abordados, mas aparece sempre em um contexto mais amplo",2014,"Nossa missão é contribuir com a melhoria da mobilidade urbana e do transporte coletivo. Pretendemos através de nossas ações, fomentar o debate sobre mobilidade urbana, que é uma questão central nas grandes cidades da América Latina e influencia diretamente o cotidiano e a qualidade de vida de seus habitantes.
",,,,,,,,,Mobilidade urbana e colaboração,,Cidade,,,,,,Empresa,,Empresa,,,,,,,,6,5,Remunerados integralmente,Remunerados parcialmente,,3,0,Bolsa de fomento,,,,Edital,,,,,Prestação de serviço,,,,,,Congressos e Seminários,,Facebook,,,,,Revista,Site,,Twitter,YouTube,,,,,,,"Microacessibilidade ao Transporte Público Coletivo [conectividade, intermodalidade]","Planejamento e desenho urbano [uso e ocupação do solo, infraestrutura de transporte, planejamento na escala do bairro/cidade]",,,,,"Comunicação e Informação [produção e compartilhamento: sites, blogs, grupos de discussão virtual]",,,,"Mobilização [ativismo, participação, engajamento e controle social]",,,,,,,,,Burocracia / meios legais de atuar,,,,,,,,,,Dados municipais abertos,,,,,Pesquisa Origem e Destino,,,Apoio financeiro,Apoio institucional,,,Parceria para ações,,,,,,,,,,2016-06-29 15:01:19,2016-06-29 15:25:18,c6f9b8bb12
