d0fd4efbc46b7bc4bf066686f20f335d,Andrea,PASEOS A PIE,andrea@paseosapie.com,http://www.paseosapie.com/,https://www.facebook.com/paseosapie/?fref=ts,SP,São Paulo (SP),,Sim,2015,"Proporcionar aos turistas estrangeiros um passeio agradável, a pé, pela cidade. Acredito que seja a melhor forma de interação com a cidade.",,,,,,,,,Turismo,Bairro / comunidade,,,,,,,,Projeto pessoal,Não formalizado,,Andrea,Feminino,,38,"Adminstração, Turismo, Responsabilidade Social e Historia da Cidade de SP",Integral,1,0,Remunerados integralmente,,,2,0,,,,,,,,,,,Trabalho voluntário,,,,,,,Facebook,,Jornal,,Rádio,Revista,Site,,,YouTube,,,,,,,,,,,,Turismo,,,,,,,,O Walking tour indica por si só a modalidade: conhecer a cidade caminhando,Divulgar a cidade caminhando,promovo a cidade de SP nas redes sociais,,Apoio político,Ausência / escassez de recursos / financiamento,,,Escassez de parcerias,,,,,,,Coleto meus próprios dados em campo,,IBGE,"Jornais, Revistas, Sites, Blogs",,"Mídias Sociais (Facebook, Twitter, Medium)",,,,,Apoio institucional,,,,,,,,,A SPTuris me ajuda distribuindo os flyers nas Centrais de Informações Turísticas,não,"não estou muito antenada no assunto. Meu interesse justamente é esse: conhecer, interagir...",Ótima iniciativa. Parabéns...,2016-04-15 11:35:50,2016-04-15 11:47:01,1fb70565f1
8a772bce2f4b00290263af02cec442a7,Renatha Morés,A Pezito,apezito@gmail.com,,https://www.facebook.com/andarapezito/?fref=ts,RS,Porto Alegre (RS),,Sim,2014,"Promover convivência, saúde, alegria e cidadania por meio de caminhadas guiadas com crianças. ",,,,,,,,Saúde e qualidade de vida,,,Cidade,,,,,,Rede,,Rede,,Renatha Morés,Feminino,,39,Jornalismo,Parcial,,1,,,Não remunerados,3,,,,,,,,,,,,,,Nenhuma fonte de financiamento,,Assessoria de Imprensa,,,Facebook,,,,,,,,,,,,,,"Infraestrutura local [calçadas, cruzamentos, escadarias, passarelas, passagens subterrâneas, travessias, sinalização, mobiliário urbano]","Meio ambiente e sustentabilidade [mudanças climáticas, energia, emissão de gases, poluição, economia sustentável]",,,"Saúde e Qualidade de Vida [sedentarismo e doenças relacionadas, como obesidade, diabetes; problemas respiratórios; estresse e depressão]","Segurança [pessoal, viária e acidentalidade vertical]",,,,"Educação e Cultura [disseminação, capacitação, intervenção artística, sensibilização]","Intervenção física no espaço [obra civil, intervenções temporárias, artísticas]",,,,,,"Atividades em escolas para estimular a caminhada a pé em crianças, incluindo a comunidade escolar e família.",,,,,,,,,Falta de colaboradores,,Falta de planejamento estratégico,,,,Dados municipais abertos,,,,,,,,,,,,Parceria para ações,,,,,,Escola Projeto e Colégio Santa Inês.,Free Walk e Bike Anjo.,Carona a Pé e WRI.,,2016-04-15 12:38:14,2016-04-15 12:54:00,2106e5e495
8f24e8154326f24167dada5ded6ad163,José Otávio Braga,Direitos Urbanos Fortaleza,webdireitosurbanos@gmail.com,https://www.facebook.com/DireitosUrbanosFortal/?fref=ts,,CE,Fortaleza (CE),,"Não, a mobilidade a pé é apenas um dos temas abordados, mas aparece sempre em um contexto mais amplo",2013,"Busca pela efetivação do Direito à Cidade, em suas diversas áreas",Arquitetura e urbanismo,,,Educação,,Meio ambiente,Políticas públicas,Saúde e qualidade de vida,,Bairro / comunidade,Cidade,,,,,,Coletivo,,Não formalizado,,,,,,,,3,30,,,Não remunerados,,,,,,Doação direta (membros associados),,,,,,,,,,,,Congressos e Seminários,E-mail / mailing / newsletter,Facebook,,Jornal,,,,,,,YouTube,,Arquitetura da edificação [interface entre espaço público e lote privado; projeto na infraestrutura para mobilidade a pé],Bicicleta [convívio entre mobilidade cicloviária e mobilidade a pé],Economia [impactos da mobilidade na economia; geração de emprego; análise de trade-off; fomento ao comércio local],"Infraestrutura local [calçadas, cruzamentos, escadarias, passarelas, passagens subterrâneas, travessias, sinalização, mobiliário urbano]","Meio ambiente e sustentabilidade [mudanças climáticas, energia, emissão de gases, poluição, economia sustentável]","Microacessibilidade ao Transporte Público Coletivo [conectividade, intermodalidade]","Planejamento e desenho urbano [uso e ocupação do solo, infraestrutura de transporte, planejamento na escala do bairro/cidade]","Saúde e Qualidade de Vida [sedentarismo e doenças relacionadas, como obesidade, diabetes; problemas respiratórios; estresse e depressão]","Segurança [pessoal, viária e acidentalidade vertical]","Tecnologia e Inovação [aplicativos, rede e plataforma online, base de dados]",,"Comunicação e Informação [produção e compartilhamento: sites, blogs, grupos de discussão virtual]","Educação e Cultura [disseminação, capacitação, intervenção artística, sensibilização]","Intervenção física no espaço [obra civil, intervenções temporárias, artísticas]",,"Mobilização [ativismo, participação, engajamento e controle social]",,"Projetos e Planos [projetos de arquitetura, desenho urbano, planos de mobilidade, diretores]",,"Multa moral em automóveis estacionados sobre calçadas e faixas de pedestre, ações de auxílio de travessia de pedestres, colocação de placas sinalizadoras de direção para os pedestres",Projetos alternativos de arquitetura e urbanismo aos oficiais / Seminários sobre diversos temas sobre a cidade / Participação em fóruns e audiências públicas,Acesso a informações,Apoio político,,Burocracia / meios legais de atuar,,,,,,,,,Coleto meus próprios dados em campo,,,"Jornais, Revistas, Sites, Blogs",Legislação,"Mídias Sociais (Facebook, Twitter, Medium)",,Trabalhos acadêmicos,,,,,,Parceria para ações,"Parceria para aprendizagem, capacitação ou treinamento",Parceria para campanhas,Parceria para mobilização e sensibilização,,,"Movimento Pró-Árvore, Movimento Proparque, Coletivo Verdejar, Ciclovida, Rei do Camarote Fortaleza, Ministério Público Federal e Estadual",,ABRASPE,Legal o site. Coloquem pesquisas para ajudar na capacitação. Algumas novidades desse ano como o Estatuto da Pessoa com Deficiência prometem reforçar nossas demandas.,2016-04-16 00:58:17,2016-04-16 02:37:54,09305b4498
5671bd9910e4c1ca9c0d0450f4a651b5,JP Amaral,Bike Anjo,jp@bikeanjo.org,http://bikeanjo.org/,https://www.facebook.com/bikeanjo,SP,São Paulo (SP),Rio de Janeiro; Belo Horizonte; Porto Alegre; Belém; Fortaleza; Recife; Aracaju; Vitória; Curitiba; Brasília,"Não, a mobilidade a pé é apenas um dos temas abordados, mas aparece sempre em um contexto mais amplo",2010,Mobilizar pessoas para transformar suas cidades por meio da bicicleta,,Comunicação,,,,,Políticas públicas,Saúde e qualidade de vida,,,Cidade,,,,Nacional,Internacional,Rede,,Associação,,JP Amaral,Masculino,,29,Gestão ambiental,Parcial,4,4,Remunerados integralmente,Remunerados parcialmente,,70,3689,,,,,,,,,Patrocínio (investimento empresarial),Prestação de serviço,Trabalho voluntário,,,,Assessoria de Imprensa,,E-mail / mailing / newsletter,Facebook,,,,,,,,,,Instagram,,Bicicleta [convívio entre mobilidade cicloviária e mobilidade a pé],,,,,,,,,,"Comunicação e Informação [produção e compartilhamento: sites, blogs, grupos de discussão virtual]","Educação e Cultura [disseminação, capacitação, intervenção artística, sensibilização]",,,"Mobilização [ativismo, participação, engajamento e controle social]",,,,"EBA - Escola Bike Anjo, onde educamos pessoas para o uso da bicicleta com respeito aos pedestres; campanhas de mobilização, como o De Bike ao Trabalho, Bike na Escola, Bicicleta nos Planos, entre outras; cartilha e capacitação em nossa plataforma online para voluntários e ciclistas iniciantes.","Creio que nenhuma ação nossa é totalmente focada em mobilidade a pé, mas sempre incluímos o tema.",Acesso a informações,Apoio político,,,Capacitação da equipe,,,,Falta de conhecimento / clareza sobre o tema,Falta de planejamento estratégico,,,Coleto meus próprios dados em campo,,,"Jornais, Revistas, Sites, Blogs",,"Mídias Sociais (Facebook, Twitter, Medium)",,,,Apoio financeiro,Apoio institucional,,,Parceria para ações,,Parceria para campanhas,Parceria para mobilização e sensibilização,,,"Corridaamiga, Transporte Ativo, UCB - União de Ciclistas do Brasil, Itaú, ICS, Sesc, WCA - World Cycling Alliance","Corridaamiga, Cidade Ativa, Associação Mobilidade a Pé, Sampapé, Minha Sampa, Cidades para Pessoas","Corridaamiga, Cidades para Pessoas, Cidade Ativa,  ","Pensem em alguma forma de conectar essa turma após a pesquisa (um lançamento da pesquisa, por ex) e também de buscar outras organizações que têm temas correlatos com a mobilidade a pé para ampliar a rede, como a turma da saúde, do esporte, da bicicleta etc.",2016-04-16 09:40:50,2016-04-16 10:09:51,50432460c8
a165ae5642a4bdf9e93e0bb814a72967,Rafael,SP Free Walking Tour,spfreewalkingtour@gmail.com,http://www.saopaulofreewalkingtour.com/,https://www.facebook.com/spfreewalkingtour/?fref=ts,SP,São Paulo (SP),,Sim,2011,"Realizar passeios à pé gratuitos para mochileiros e viajantes, oferecendo um panorama histórico, turístico, cultural e local de São Paulo, com qualidade e profissionalismo, de uma maneira honesta, saudável e transparente.",,,,,,,,,Turismo,,Cidade,,,,,Internacional,Empresa,,Empresa,,,,,,,,,,,,,,,,,,,,,,,,,,,,,Assessoria de Imprensa,,E-mail / mailing / newsletter,Facebook,,,,,,Site,,,YouTube,,,,,,,,,,,,,"Comunicação e Informação [produção e compartilhamento: sites, blogs, grupos de discussão virtual]",,,,,,,,passeios turísticos a pé,,,,,,,,,,,,,,Coleto meus próprios dados em campo,,IBGE,"Jornais, Revistas, Sites, Blogs",,"Mídias Sociais (Facebook, Twitter, Medium)",Pesquisa Origem e Destino,,,,,,,Parceria para ações,,Parceria para campanhas,,,,,,,,2016-04-16 16:59:57,2016-04-16 17:10:38,ea8a140207
e80103ee7d15e841b068bfedd050b43c,Willian Cruz,Vá de Bike,contato@vadebike.org,http://vadebike.org,https://www.facebook.com/VaDeBike/?fref=ts,SP,São Paulo (SP),,"Não, a mobilidade a pé é apenas um dos temas abordados, mas aparece sempre em um contexto mais amplo",2002,"O Vá de Bike se tornou referência no Brasil quando o assunto é bicicleta, com dicas para quem quer começar a pedalar nas ruas, informações para quem quer entender a mobilidade por bicicleta, cobertura de eventos, divulgação de ações e estratégias de entidades que defendem os ciclistas, e notícias e análises sobre o uso da bicicleta como meio de transporte, contemplando também o esporte e o lazer. Também falamos bastante sobre cicloturismo, porque viajar de bicicleta é uma experiência que muda a gente por dentro e a gente quer que mais pessoas consigam viver isso. :)

Nossa atividade vai além do que se vê no site, com palestras, eventos e ações práticas de ativismo, como reuniões com o poder público, participação atividades de instituições que defendem os ciclistas e até em manifestações de rua quando a situação exige. Também trabalhamos junto a empresas, sejam elas do setor de bicicleta ou não, para trazê-las mais perto dos ciclistas de forma que possam colaborar, a seu modo, com a mobilidade sustentável, conversando com esses novos atores das cidades e se adaptando a esse novo tempo, que sem dúvida veio para ficar.",,Comunicação,,,,,,,,,,,,,Nacional,,Movimento Social,,Empresa,,Willian Cruz,Masculino,,42,Superior completo (mestrado incompleto),Integral,2,40,Remunerados integralmente,Remunerados parcialmente,,60,0,,,,,,,,,Patrocínio (investimento empresarial),Prestação de serviço,,Venda de produtos,,,,,E-mail / mailing / newsletter,Facebook,,,,,,Site,,Twitter,YouTube,"Palestras, debates e rodas de conversa promovidas por entidades e pelo Sesc, encontros, ações e atividades de cicloativismo e de promoção ao ciclismo, participações em entrevistas e matérias de TV, jornal e internet.",,Bicicleta [convívio entre mobilidade cicloviária e mobilidade a pé],,"Infraestrutura local [calçadas, cruzamentos, escadarias, passarelas, passagens subterrâneas, travessias, sinalização, mobiliário urbano]",,,"Planejamento e desenho urbano [uso e ocupação do solo, infraestrutura de transporte, planejamento na escala do bairro/cidade]",,,,,"Comunicação e Informação [produção e compartilhamento: sites, blogs, grupos de discussão virtual]",,,,"Mobilização [ativismo, participação, engajamento e controle social]",,,,"Em nossas matérias, é comum reforçarmos a importância de se proteger o pedestre e dar condições de travessia segura. Temos matérias específicas sobre a dificuldade de atravessar as ruas e sobre como a estrutura cicloviária protege os pedestres (para dar dois exemplos). Sempre que explicamos os motivos de não pedalar na contramão (em matérias, palestras, entrevistas, cursos), citamos o risco de atropelar um pedestre, que só vai olhar para o lado de onde vêm os carros para fazer a travessia. O cuidado e a proteção ao pedestre fazem parte de um de nossos conceitos de base para um uso consciente e seguro da bicicleta. É indissociável.","Puxa, gente, é tanta coisa. Acho que já coloquei um resumo na descrição das nossas atividades, lá pra cima. Mas se for pra resumir, queremos mais gente pedalando e que esse uso seja seguro, não só pelo comportamento do ciclista, mas também pelo do motorista e pelas políticas públicas de incentivo e proteção a quem pedala nas cidades. Todas nossas atividades giram em torno disso. Sem falsa modéstia, nosso histórico é longo e conhecido, tendo nos garantido reconhecimento e confiabilidade ao longo de tantos anos. Principalmente por irmos além do discurso e do jornalismo tradicional, fazendo ativismo de informação e de ações. Não sei se consegui responder ou se acabei sendo poético. :p",Acesso a informações,,Ausência / escassez de recursos / financiamento,,,,,,,,,"Apenas para esclarecer: pela escassez de recursos, não conseguimos publicar tantas matérias quanto poderíamos e acabamos tendo que filtrar, dando prioridade àquelas relacionadas ao tema principal do nosso trabalho, que é a bicicleta. :/ E o acesso às informações foi citado porque não há (ou desconhecemos) informação farta sobre mobilidade a pé (ou talvez estejamos focando nossos esforços de busca apenas em informações sobre o uso da bicicleta, que talvez sejam muito mais difíceis de encontrar e por isso absorvem todo o tempo que teríamos para procurar dados).",,Dados municipais abertos,,"Jornais, Revistas, Sites, Blogs",Legislação,"Mídias Sociais (Facebook, Twitter, Medium)",Pesquisa Origem e Destino,Trabalhos acadêmicos,,Apoio financeiro,Apoio institucional,,,Parceria para ações,,,Parceria para mobilização e sensibilização,,,"Ciclocidade, Bike Anjo, Transporte Ativo, Virada Sustentável; Itaú, Shimano, Levi's, Sesc, Milk Comunicação e outras em menor escala (publicidade pontual no site, por exemplo).","SampaPé, Corrida Amiga","Para mim, as poucas que eu conheço acabam sendo minha referência. :)",,2016-04-18 13:07:44,2016-04-18 13:55:56,7000ab28c7
3a659eef016252194d2482a5ec9a4df7,Camila Saturnino Braga Ennes,Bike Anjo - Niterói,camilasbe@gmail.com,,https://www.facebook.com/bikeanjoniteroi/?fref=ts,RJ,Niterói (RJ),"São Paulo, Brasília, Fortaleza, Vitória, Vila Velha, Volta Redonda, Niterói, Rio de Janeiro, Belo Horizonte, Juiz de Fora, Recife, Teresina, Curitiba, Blumenau, Florianópolis, Jundiaí, Santos, Salvador, DENTRE OUTRAS..","Não, a mobilidade a pé é apenas um dos temas abordados, mas aparece sempre em um contexto mais amplo",2010,"Bike Anjo é uma rede de ciclistas apaixonados pela bicicleta que promove, mobiliza e ajuda pessoas a começarem a utilizar esse veículo nas cidades. Acreditamos que a bicicleta é uma ferramenta de transformação social e quanto mais gente, melhor serão nossas cidades.",Arquitetura e urbanismo,,,,,Meio ambiente,Políticas públicas,Saúde e qualidade de vida,,Bairro / comunidade,Cidade,Regiões Metropolitanas (várias cidades),,,,,Rede,,,,,,,,,,,,,,Não remunerados,,,,,,,,,,,,,,,,,,,,Facebook,,Jornal,,,,,,,,,,Bicicleta [convívio entre mobilidade cicloviária e mobilidade a pé],,,"Meio ambiente e sustentabilidade [mudanças climáticas, energia, emissão de gases, poluição, economia sustentável]",,,,,,,"Comunicação e Informação [produção e compartilhamento: sites, blogs, grupos de discussão virtual]","Educação e Cultura [disseminação, capacitação, intervenção artística, sensibilização]",,,"Mobilização [ativismo, participação, engajamento e controle social]",,"Projetos e Planos [projetos de arquitetura, desenho urbano, planos de mobilidade, diretores]",,Educação e disseminação da boa convivência entre meios de transporte e prioridade dos pedestres nas cidades.,,,,,,,,,,,,,,,,,,,,,,,,,,,,,,,,,,,Sampa a pé,,2016-04-18 14:39:50,2016-04-18 14:52:03,e981f4e369
3e6bb62cb4dcb44a0cf5e27ad6770bf0,Luiza de Andrada e Silva,IVM - Instituto Cidade em Movimento,luiza.andrada@cidadeemmovimento.org,http://www.cidadeemmovimento.org/,https://www.facebook.com/institutocidadeemmovimento/?fref=ts,SP,São Paulo (SP),"Paris, Buenos Aires, Shangai","Não, mas uma das principais iniciativas da organização trata do tema",2000,"A missão do Instituto Cidade em Movimento é contribuir para a melhora da mobilidade urbana em todas as suas formas, por meio de apoio e execução de trabalhos, pesquisas, projetos e ações de acordo com os seguintes temas:

    Acesso à mobilidade por pessoas com necessidades especiais e os mais vulneráveis;
    Melhora dos espaços da mobilidade, da informação, dos tempos e da qualidade dos deslocamentos pela cidade
    Intermodalidade;

Divulgação de experiências e conhecimentos sobre a “cidade em movimento ‘, sua cultura e valores cívicos por meio de seminários nacionais e internacionais, concursos, exposições, publicação de livros, revistas, folhetos etc.

",,,,,,,Políticas públicas,,,,,Regiões Metropolitanas (várias cidades),,,,,Organização da Sociedade Civil de Interesse Público (OSCIP),,Organização da Sociedade Civil de Interesse Público (OSCIP),,Luiza de Andrada e Silva,Feminino,,50,Ciencias da Educação e Gestão Políticas públicas,Integral,2,6,Remunerados integralmente,,Não remunerados,3,1,,,Doação direta (Investimento social/filantrópico),,,,,,,,,,,,Assessoria de Imprensa,,E-mail / mailing / newsletter,Facebook,,,Publicação científica,,,Site,,,,,,,,"Infraestrutura local [calçadas, cruzamentos, escadarias, passarelas, passagens subterrâneas, travessias, sinalização, mobiliário urbano]",,"Microacessibilidade ao Transporte Público Coletivo [conectividade, intermodalidade]","Planejamento e desenho urbano [uso e ocupação do solo, infraestrutura de transporte, planejamento na escala do bairro/cidade]",,,,,"Comunicação e Informação [produção e compartilhamento: sites, blogs, grupos de discussão virtual]","Educação e Cultura [disseminação, capacitação, intervenção artística, sensibilização]",,,,"Pesquisa [diagnóstico, caracterização, indicadores]",,,uma linha de pesquisa que há quase dez anos estuda a relação com a rua. Fizemos exposição e publicação de dois livros. temos também um programa que se chama Cidade Legível e promove estudos e projetos para q os pedestres tenho sempre informação sobre a cidade e não apenas sobre o transporte,um premio bianual sobre iniciativas da sociedade civil para melhora da mobilidade. A linha de pesquisa Fabrica do Movimento - sobre políticas públicas.,,Apoio político,Ausência / escassez de recursos / financiamento,Burocracia / meios legais de atuar,,,,,,,,,Coleto meus próprios dados em campo,Dados municipais abertos,IBGE,"Jornais, Revistas, Sites, Blogs",Legislação,"Mídias Sociais (Facebook, Twitter, Medium)",Pesquisa Origem e Destino,Trabalhos acadêmicos,,,,,Parceria para pesquisas,Parceria para ações,,Parceria para campanhas,,,,"Grupo Peugeot, SPobras, Universidade Mackenzie, IAB- SP, Cidade Ativa. Museu da Casa Brasileira, Ready Make, rede de pesquisadores do Jd Angela, Antp
","corrida amiga, mobilize, cidade a pé",mobilize,este ano lançaremos a segunda edição do Premio Mobildiade MInuto - a temática deste ano poderia ser andar a pé. querem conversar?,2016-04-18 16:06:36,2016-04-18 16:37:42,37386bc490
c5e00067826c000c6853f05e84587452,Goura Nataraj (Jorge Brand),Coordenação de Mobilidade Urbana (CMOB / SETRAN),  ggarrett@setran.curitiba.pr.gov.br,http://www.setran.curitiba.pr.gov.br/,,PR,Curitiba (PR),,"Não, mas uma das principais iniciativas da organização trata do tema",2013,"Humanizar o trânsito na capital paranaense com foco especial nos ciclistas, pedestres e na acessibilidade",Arquitetura e urbanismo,Comunicação,,Educação,,,Políticas públicas,,,Bairro / comunidade,Cidade,,,,,,Orgão Público,,Orgão Público,,Gustavo Garrett,Masculino,,38,Pós graduação em Arquitetura e Urbanismo,Integral,8,0,Remunerados integralmente,,,,50,,,,,,,,Orçamento Público,,,,,,,Assessoria de Imprensa,Congressos e Seminários,,Facebook,,,,,,,,,,,,Bicicleta [convívio entre mobilidade cicloviária e mobilidade a pé],,"Infraestrutura local [calçadas, cruzamentos, escadarias, passarelas, passagens subterrâneas, travessias, sinalização, mobiliário urbano]",,,,,,,,"Comunicação e Informação [produção e compartilhamento: sites, blogs, grupos de discussão virtual]","Educação e Cultura [disseminação, capacitação, intervenção artística, sensibilização]","Intervenção física no espaço [obra civil, intervenções temporárias, artísticas]","Legislação e Políticas Públicas [produção e revisão de leis, planos e programas relacionados à mobilidade a pé]",,,"Projetos e Planos [projetos de arquitetura, desenho urbano, planos de mobilidade, diretores]",,"Constituição de cultura através de abordagens e campanhas educativas; orientação, monitoramento e fiscalização; todas essas ações com foco na mobilidade e acessibilidade seguras.","A CMOB nestes 3 anos de existência tem atuado com mais intensidade na promoção da ciclomobilidade, mas procurando, aos poucos, abranger a caminhabilidade nas ações e projetos desenvolvidos.       http://www.curitiba.pr.gov.br/conteudo/mais-bici-sobre-a-coordenadoria/2222",,,Ausência / escassez de recursos / financiamento,Burocracia / meios legais de atuar,,,,,,,,,,Dados municipais abertos,,,Legislação,,,Trabalhos acadêmicos,,,,,Parceria para pesquisas,Parceria para ações,,Parceria para campanhas,Parceria para mobilização e sensibilização,,,CicloIguaçu - Associação de Ciclistas do Alto Iguaçu / Observatório Nacional de Segurança Viária / Instituto Paz no Trânsito / ANAMOB / Grupos de pedaladas / Universidades locais,Não!,(queremos conhecer!!),Grande iniciativa! Que prospere e traga frutos para melhorar a caminhabilidade nas cidades brasileiras!,2016-04-18 19:04:58,2016-04-18 19:26:47,2876c2fb60
5e672bf26cc94cb6bdbc9a4e472e399b,Julia Sollero de Paula,MOB - Movimente e Ocupe seu Bairro ,contato@coletivomob.com,http://www.coletivomob.com/,https://www.facebook.com/coletivomob/?fref=ts,DF,Brasília (DF),,"Não, a mobilidade a pé é apenas um dos temas abordados, mas aparece sempre em um contexto mais amplo",2015,"A vontade de ver espaços públicos mais ocupados, vivo e valorizados, portanto atuamos em tudo que envolve tal objetivo final: consciência coletiva, mobilidade urbana, pró-atividade cidadã, etc.",Arquitetura e urbanismo,Comunicação,,,,,,,,Bairro / comunidade,Cidade,,,,,,Coletivo,,Em processo de formalização,,,,,,,,1,4,,,Não remunerados,4,30,,,,,,,,,,,Trabalho voluntário,,,,,,,Facebook,,,Publicação científica,,,Site,,,YouTube,,,Bicicleta [convívio entre mobilidade cicloviária e mobilidade a pé],,"Infraestrutura local [calçadas, cruzamentos, escadarias, passarelas, passagens subterrâneas, travessias, sinalização, mobiliário urbano]",,"Microacessibilidade ao Transporte Público Coletivo [conectividade, intermodalidade]","Planejamento e desenho urbano [uso e ocupação do solo, infraestrutura de transporte, planejamento na escala do bairro/cidade]",,,,,"Comunicação e Informação [produção e compartilhamento: sites, blogs, grupos de discussão virtual]","Educação e Cultura [disseminação, capacitação, intervenção artística, sensibilização]","Intervenção física no espaço [obra civil, intervenções temporárias, artísticas]",,"Mobilização [ativismo, participação, engajamento e controle social]",,,,"Ainda não tivemos ações voltadas especificamente para o pedestre, mas batalhamos muito pela mobilidade ativa e intermodalidade.",Idem,,,Ausência / escassez de recursos / financiamento,Burocracia / meios legais de atuar,,,,,,Falta de planejamento estratégico,,,Coleto meus próprios dados em campo,,,"Jornais, Revistas, Sites, Blogs",Legislação,"Mídias Sociais (Facebook, Twitter, Medium)",,Trabalhos acadêmicos,,,Apoio institucional,Apoio político,,Parceria para ações,,,Parceria para mobilização e sensibilização,,,"Administrações regionais, CNI, urbanizadora paranoazinho, coletivos e artistas locais. ",Cidade para Pessoas,Não sei,,2016-04-19 11:19:25,2016-04-19 11:35:57,49d842c3e3
