#,Qual seu nome?,Qual o nome da organização da qual faz parte?,Email da organização ou pessoal:,Site da organização:,Facebook da organização:,Estado:,Cidade:,"Cite aqui outras cidades onde sua organização se localiza, se houver:",Mobilidade a pé é o foco principal da sua organização?,Quando sua organização surgiu?,O que move sua organização?,Arquitetura e urbanismo,Comunicação,Direito,Educação,Engenharia ,Meio ambiente,Políticas públicas,Saúde e qualidade de vida,Other,Bairro / comunidade,Cidade,Regiões Metropolitanas (várias cidades),Estado,Vários Estados / Regional,Nacional,Internacional,Como sua organização se autodenomina?,Other,Como vocês estão formalizados?,Other,Nome do(a) coordenador(a):,Gênero do(a) coordenador(a):,Other,Idade do(a) coordenador(a):,Formação acadêmica do(a) coordenador(a):,Dedicação do(a) coordenador(a):,Número de membros com dedicação integral,Número de membros com dedicação parcial,Remunerados integralmente,Remunerados parcialmente,Não remunerados,Número de colaboradores com dedicação pontual nos últimos doze meses,Número de voluntários com dedicação pontual nos últimos doze meses,Bolsa de fomento,Convênio (poder público),Doação direta (Investimento social/filantrópico),Doação direta (membros associados),Edital,Financiamento coletivo (crowdfunding),Leis de incentivo (ex. Lei de incentivo ao esporte),Orçamento Público,Patrocínio (investimento empresarial),Prestação de serviço,Trabalho voluntário,Venda de produtos,Nenhuma fonte de financiamento,Other,Assessoria de Imprensa,Congressos e Seminários,E-mail / mailing / newsletter,Facebook,LinkedIn,Jornal,Publicação científica,Rádio,Revista,Site,TV,Twitter,YouTube,Other,Arquitetura da edificação [interface entre espaço público e lote privado; projeto na infraestrutura para mobilidade a pé],Bicicleta [convívio entre mobilidade cicloviária e mobilidade a pé],Economia [impactos da mobilidade na economia; geração de emprego; análise de trade-off; fomento ao comércio local],"Infraestrutura local [calçadas, cruzamentos, escadarias, passarelas, passagens subterrâneas, travessias, sinalização, mobiliário urbano]","Meio ambiente e sustentabilidade [mudanças climáticas, energia, emissão de gases, poluição, economia sustentável]","Microacessibilidade ao Transporte Público Coletivo [conectividade, intermodalidade]","Planejamento e desenho urbano [uso e ocupação do solo, infraestrutura de transporte, planejamento na escala do bairro/cidade]","Saúde e Qualidade de Vida [sedentarismo e doenças relacionadas, como obesidade, diabetes; problemas respiratórios; estresse e depressão]","Segurança [pessoal, viária e acidentalidade vertical]","Tecnologia e Inovação [aplicativos, rede e plataforma online, base de dados]",Other,"Comunicação e Informação [produção e compartilhamento: sites, blogs, grupos de discussão virtual]","Educação e Cultura [disseminação, capacitação, intervenção artística, sensibilização]","Intervenção física no espaço [obra civil, intervenções temporárias, artísticas]","Legislação e Políticas Públicas [produção e revisão de leis, planos e programas relacionados à mobilidade a pé]","Mobilização [ativismo, participação, engajamento e controle social]","Pesquisa [diagnóstico, caracterização, indicadores]","Projetos e Planos [projetos de arquitetura, desenho urbano, planos de mobilidade, diretores]",Other,Quais as principais ações da sua organização voltadas para mobilidade a pé?,E as outras ações nas quais a mobilidade a pé não é o foco?,Acesso a informações,Apoio político,Ausência / escassez de recursos / financiamento,Burocracia / meios legais de atuar,Capacitação da equipe,Escassez de parcerias,Escassez de voluntários,Falta de colaboradores,Falta de conhecimento / clareza sobre o tema,Falta de planejamento estratégico,Interesse das lideranças da organização,Other,Coleto meus próprios dados em campo,Dados municipais abertos,IBGE,"Jornais, Revistas, Sites, Blogs",Legislação,"Mídias Sociais (Facebook, Twitter, Medium)",Pesquisa Origem e Destino,Trabalhos acadêmicos,Other,Apoio financeiro,Apoio institucional,Apoio político,Parceria para pesquisas,Parceria para ações,"Parceria para aprendizagem, capacitação ou treinamento",Parceria para campanhas,Parceria para mobilização e sensibilização,Não possuímos ações em parceria,Other,Mencione as organizações com as quais atua ou atuou nos últimos doze meses em parceria:,"Conhece organizações que atuam em mobilidade a pé na sua cidade? Se sim, cite-as.","No Brasil, quais organizações acredita que são referência no tema da mobilidade a pé?",Tem algum comentário ou sugestão para o Como Anda?,Start Date (UTC),Submit Date (UTC),Network ID
ab402fef0543b4b35a619c421915cd09,Joana Canedo,Cidadeapé - Associação pela Mobilidade a Pé em São Paulo,joanacanedo@gmail.com,https://cidadeape.org/,https://www.facebook.com/cidadeapesp/,SP,São Paulo (SP),,Sim,2015,Ter uma representatividade formal perante o poder público a fim de defender as condições dos espaços da cidade para quem se desloca a pé: os pedestres.,,,,,,,Políticas públicas,,,,Cidade,,,,,,Associação,,Não formalizado,,,,,,,,0,6,,,Não remunerados,,10,,,,,,,,,,,,,Nenhuma fonte de financiamento,,,,E-mail / mailing / newsletter,Facebook,,,,,,Site,,,YouTube,,,,,"Infraestrutura local [calçadas, cruzamentos, escadarias, passarelas, passagens subterrâneas, travessias, sinalização, mobiliário urbano]",,"Microacessibilidade ao Transporte Público Coletivo [conectividade, intermodalidade]","Planejamento e desenho urbano [uso e ocupação do solo, infraestrutura de transporte, planejamento na escala do bairro/cidade]",,,,,"Comunicação e Informação [produção e compartilhamento: sites, blogs, grupos de discussão virtual]","Educação e Cultura [disseminação, capacitação, intervenção artística, sensibilização]",,"Legislação e Políticas Públicas [produção e revisão de leis, planos e programas relacionados à mobilidade a pé]","Mobilização [ativismo, participação, engajamento e controle social]","Pesquisa [diagnóstico, caracterização, indicadores]",,,"Pesquisa: Levantamento, produção e divulgação de dados e conhecimentos sobre a mobilidade urbana em São Paulo, em particular no que se refere à mobilidade a pé. Quem são os pedestres de um determinado local, suas necessidades, suas dificuldades, sua interação com outros modais.

Temos uma biblioteca  digital sobre o tema da mobilidade a pé e da caminhabilidade.

Participação: Construímos propostas em favor de quem se desloca a pé e identificamos demandas de pedestres em diferentes locais da cidade. Trabalhamos para o desenvolvimento de políticas públicas voltadas para a mobilidade a pé, abrindo espaço para a participação da sociedade na discussão e no desenvolvimento das propostas.

Cultura da caminhada:  Queremos promover a ideia de que andar a pé é uma opção: agradável, saudável, barata, sustentável, eficiente (mesmo se não é a mais rápida),  e definitivamente disponível para a maioria de nós.

FOCOS DE AÇÃO

Plano de Mobilidade: o pedestre deve ser figura preeminente nos planos de mobilidade das cidades, pois o modo de transporte a pé é o mais utilizado de São Paulo e o único que se integra com todos os outros modais.

Calçadas: melhoria dos passeios da cidade, que devem ser largos, sem obstáculos e em bom estado de conservação.

Equipamentos e mobiliário urbano: ruas com estrutura adequada para garantir o deslocamento a pé com qualidade e conforto, assim como acesso a equipamentos públicos e privados e outros meios de transporte.

Sinalização: implementação de sinalização para ajudar o pedestre a se encontrar e se informar na cidade, facilitando seu deslocamento.","Capacitação de cidadãos em geral sobre temas relacionados à mobilidade a pé: legislação, infraestrutura, canais com o poder público, etc.",,,,,,,Escassez de voluntários,,,,,,,Dados municipais abertos,,"Jornais, Revistas, Sites, Blogs",Legislação,"Mídias Sociais (Facebook, Twitter, Medium)",Pesquisa Origem e Destino,,,,Apoio institucional,Apoio político,,Parceria para ações,"Parceria para aprendizagem, capacitação ou treinamento",Parceria para campanhas,Parceria para mobilização e sensibilização,,,"CT Mobilidade a Pé e Acessibilidade da ANTP, Corrida Amiga, Sampapé, Ciclocidade, Greenpeace, Rede Nossa São Paulo, Rede Butantã, Mobilize","CT Mobilidade a Pé e Acessibilidade da ANTP, Corrida Amiga, Sampapé, Cidade Ativa, Desbravadores de Sampa","Sampapé, Corrida Amiga, CT Mobilidade a Pé e Acessibilidade da ANTP, Cidade Ativa",,2016-04-05 16:48:47,2016-04-05 17:10:08,322aebfa66
188e8390780cee3051076dcc50e10a73,Paula Rocha,WRI Brasil Cidades Sustentáveis,paula.rocha@wri.org,http://www.wribrasil.org.br/pt,https://www.facebook.com/wricidades/?fref=ts,RS,Porto Alegre (RS),,"Não, mas uma das principais iniciativas da organização trata do tema",2005,Promover soluções sustentáveis em transporte e mobilidade urbana para melhorar a qualidade de vida nas cidades brasileiras.,Arquitetura e urbanismo,Comunicação,,,Engenharia ,Meio ambiente,Políticas públicas,Saúde e qualidade de vida,,,Cidade,Regiões Metropolitanas (várias cidades),Estado,,Nacional,,Organização Social (OS),,Organização Social (OS),,Luiz Antônio Lindau,Masculino,,60,Engenheiro Civil,Integral,40,0,Remunerados integralmente,,,,0,,,Doação direta (Investimento social/filantrópico),,Edital,,,,,,,,,,,,E-mail / mailing / newsletter,Facebook,,,,,,Site,,Twitter,,,,Bicicleta [incentivo ao uso da bicicleta em geral],,"Infraestrutura local [calçadas, cruzamentos, escadarias, passarelas, passagens subterrâneas, travessias, sinalização, mobiliário urbano]","Meio ambiente e sustentabilidade [mudanças climáticas, energia, emissão de gases, poluição, economia sustentável]","Microacessibilidade ao Transporte Público Coletivo [conectividade, intermodalidade]","Planejamento e desenho urbano [uso e ocupação do solo, infraestrutura de transporte, planejamento na escala do bairro/cidade]","Saúde e Qualidade de Vida [sedentarismo e doenças relacionadas, como obesidade, diabetes; problemas respiratórios; estresse e depressão]",,,,"Comunicação e Informação [produção e compartilhamento: sites, blogs, grupos de discussão virtual]","Educação e Cultura [disseminação, capacitação, intervenção artística, sensibilização]",,"Legislação e Políticas Públicas [produção e revisão de leis, planos e programas relacionados à mobilidade a pé]",,"Pesquisa [diagnóstico, caracterização, indicadores]",,,"Capacitação do corpo técnico de prefeituras para realização de melhores projetos urbanos para pedestres, publicações, engajamento dos profissionais do planejamento urbano através de concursos de projetos, diagnósticos e baselines de áreas urbanas para fins de pesquisa, auditorias de segurança viárias ao longo de corredores estruturantes do transporte coletivo.","Todos os projetos são pensados a partir da ótica da pessoa. Assim, a associação com a mobilidade a pé ocorre de forma generalizada.",Acesso a informações,Apoio político,,,,,,,Falta de conhecimento / clareza sobre o tema,,,,Coleto meus próprios dados em campo,Dados municipais abertos,IBGE,"Jornais, Revistas, Sites, Blogs",Legislação,,,Trabalhos acadêmicos,,Apoio financeiro,Apoio institucional,Apoio político,Parceria para pesquisas,Parceria para ações,"Parceria para aprendizagem, capacitação ou treinamento",,,,,"ITDP, Cidade Ativa, USP Cidades, Walk 2, Federação Internacional de Pedestres, Bike Anjo",,"Cidade Ativa, ITDP, Mobilize",,2016-04-05 17:10:15,2016-04-05 17:21:16,322aebfa66
998b547318d9c463320d27ff7b94b8b8,Nelson,Mobilize,nelson.avella@mobilize.org.br,http://mobilize.org.br/,https://www.facebook.com/portalmobilize/?fref=ts,SP,São Paulo (SP),,"Não, mas uma das principais iniciativas da organização trata do tema",2011,Despertar o interesse e promover o acesso ao conhecimento de forma a gerar consciência e autonomia para o desenvolvimento pessoal e oportunidade de transformação social.,,,,,,,Políticas públicas,,,,,,,,Nacional,,Organização da Sociedade Civil de Interesse Público (OSCIP),,Organização da Sociedade Civil de Interesse Público (OSCIP),,Ricky Ribeiro,Masculino,,36,Administrador,Parcial,0,7,Remunerados integralmente,,,0,100,,,,,,,,,Patrocínio (investimento empresarial),,,,,,,,E-mail / mailing / newsletter,Facebook,,,,,,Site,,Twitter,,,,Bicicleta [convívio entre mobilidade cicloviária e mobilidade a pé],,"Infraestrutura local [calçadas, cruzamentos, escadarias, passarelas, passagens subterrâneas, travessias, sinalização, mobiliário urbano]",,"Microacessibilidade ao Transporte Público Coletivo [conectividade, intermodalidade]","Planejamento e desenho urbano [uso e ocupação do solo, infraestrutura de transporte, planejamento na escala do bairro/cidade]",,,"Tecnologia e Inovação [aplicativos, rede e plataforma online, base de dados]",,,"Educação e Cultura [disseminação, capacitação, intervenção artística, sensibilização]",,,"Mobilização [ativismo, participação, engajamento e controle social]","Pesquisa [diagnóstico, caracterização, indicadores]",,,"Campanha ""Calçadas do Brasil"" ","Campanha ""Sinalize!""",,,Ausência / escassez de recursos / financiamento,,,,,,,,,,Coleto meus próprios dados em campo,Dados municipais abertos,IBGE,"Jornais, Revistas, Sites, Blogs",Legislação,"Mídias Sociais (Facebook, Twitter, Medium)",Pesquisa Origem e Destino,Trabalhos acadêmicos,,,,,Parceria para pesquisas,Parceria para ações,"Parceria para aprendizagem, capacitação ou treinamento",Parceria para campanhas,Parceria para mobilização e sensibilização,,,"ANTP, NTU, ITDP, Cidade Ativa, USP Cidades, Corridaamiga, Ciclocidade, UCB, FGV, UFMG, UFJF, UFSC, UFRJ","Corridaamida, Cidade a Pé, Sampapé, Cidade Ativa, ANTP",,,2016-04-05 18:37:01,2016-04-05 18:55:18,322aebfa66
43727158104a881a2b7c9ed271062e83,Caroline,Escola de Ativismo,caroline.donatti@gmail.com,https://ativismo.org.br/,https://www.facebook.com/ativismo/?fref=ts,,,,"Não, a mobilidade a pé é apenas um dos temas abordados, mas aparece sempre em um contexto mais amplo",2011,"A Escola de Ativismo é um coletivo independente constituído em 2012 com a missão de fortalecer o ativismo no Brasil por meio de processos de aprendizagem em estratégias e técnicas de ações não-violentas, campanhas, comunicação, mobilização, ações criativas e segurança da informação, voltadas para a defesa da democracia, dos direitos humanos e da sustentabilidade.",,,,,,,,,Aprendizagem,,,,,,Nacional,,Coletivo,,Coletivo,,,,,,,,0,10,Remunerados integralmente,,,0,8,,,Doação direta (Investimento social/filantrópico),,,,,,,,,,,,,,,Facebook,,,,,,,,,,,,,,,,,,,,,Aprendizagem,,,,,,,,Aprendizagem,Não há,Laboratório de ações políticas com grupos que atuam com mobilidade,,,,,,,,,,,,Falta de priorizacão sobre este tema dentro do coletivo. ,,Dados municipais abertos,,"Jornais, Revistas, Sites, Blogs",Legislação,,,,,,,,,,"Parceria para aprendizagem, capacitação ou treinamento",,,,,"iCS, Oxfam, Iema, iEB",,"Cidade a pé, Sampapé, Corrida Amiga, Cidade Ativa",,2016-04-05 18:55:24,2016-04-05 19:05:11,322aebfa66
a2fe056aea0502af97dd245ae5b484d9,Sandra Morikawa,JBMC Arquitetura & Urbanismo,sandra@jbmc.com.br,http://jbmc.com.br/,https://www.facebook.com/jbmc.br/?fref=ts,SP,São Paulo (SP),,"Não, a mobilidade a pé é apenas um dos temas abordados, mas aparece sempre em um contexto mais amplo",1997,"A empresa se apresenta profundamente envolvida com questões técnicas e humanas, sendo incansável na busca de resultados consistentes, simples e inovadores. ",Arquitetura e urbanismo,,,,,,,,,Bairro / comunidade,Cidade,Regiões Metropolitanas (várias cidades),,,,,Empresa,,Empresa,,João Batista Martinez Corrêa,Masculino,,73,Arquiteto,Parcial,12,3,Remunerados integralmente,,,,1,,,,,,,,,,Prestação de serviço,,,,,,,E-mail / mailing / newsletter,Facebook,,,,,Revista,Site,,,,,Arquitetura da edificação [interface entre espaço público e lote privado; projeto na infraestrutura para mobilidade a pé],Bicicleta [convívio entre mobilidade cicloviária e mobilidade a pé],,"Infraestrutura local [calçadas, cruzamentos, escadarias, passarelas, passagens subterrâneas, travessias, sinalização, mobiliário urbano]","Meio ambiente e sustentabilidade [mudanças climáticas, energia, emissão de gases, poluição, economia sustentável]","Microacessibilidade ao Transporte Público Coletivo [conectividade, intermodalidade]","Planejamento e desenho urbano [uso e ocupação do solo, infraestrutura de transporte, planejamento na escala do bairro/cidade]",,,,,,,"Intervenção física no espaço [obra civil, intervenções temporárias, artísticas]",,,,"Projetos e Planos [projetos de arquitetura, desenho urbano, planos de mobilidade, diretores]",,"Microacessibilidade em equipamentos públicos e demais projetos desenvolvidos. A natureza dos principais projetos do escritório (estações intermodais de metrô, trem e ônibus) demanda reflexões que resultem em espaços públicos de qualidade para a sociedade.",Os projetos desenvolvidos são comumente citados como referência em eventos e seminários de mobilidade urbana.,,Apoio político,Ausência / escassez de recursos / financiamento,,,Escassez de parcerias,,,,,,,,,,,Legislação,,Pesquisa Origem e Destino,Trabalhos acadêmicos,,,,,,,,,,Não possuímos ações em parceria,,,"Cidade Ativa, Corrida Amiga, SampaPé, Mobilize, Cidadeapé","Cidade Ativa, Corrida Amiga, SampaPé, Mobilize, Cidadeapé, ANTP, CET",Um dos produtos do Como Anda poderia ser a sugestão de possíveis parcerias entre instituições e até mesmo indivíduos com interesses similares.,2016-04-05 19:17:11,2016-04-05 19:22:38,322aebfa66
8df815e88320b894b2b6a67813bbb9b3,Mariane Christovam,Zoom Urbanismo Arquitetura e Design,ct.mariane@gmail.com,http://www.zoom.arq.br/,https://www.facebook.com/zoomarquitetura/,SP,São Paulo (SP),,"Não, a mobilidade a pé é apenas um dos temas abordados, mas aparece sempre em um contexto mais amplo",2010,acho que não temos uma definida,Arquitetura e urbanismo,,,,,,,,,Bairro / comunidade,,,,,,,Empresa,,Empresa,,Guilherme Ortenblad,Masculino,,33,Arquiteto,Integral,5,2,Remunerados integralmente,,,,,,,,,,,,,,Prestação de serviço,,,,,,,E-mail / mailing / newsletter,Facebook,,Jornal,,,Revista,Site,,,,,Arquitetura da edificação [interface entre espaço público e lote privado; projeto na infraestrutura para mobilidade a pé],Bicicleta [convívio entre mobilidade cicloviária e mobilidade a pé],,"Infraestrutura local [calçadas, cruzamentos, escadarias, passarelas, passagens subterrâneas, travessias, sinalização, mobiliário urbano]",,,,,,,,"Comunicação e Informação [produção e compartilhamento: sites, blogs, grupos de discussão virtual]","Educação e Cultura [disseminação, capacitação, intervenção artística, sensibilização]","Intervenção física no espaço [obra civil, intervenções temporárias, artísticas]",,"Mobilização [ativismo, participação, engajamento e controle social]",,"Projetos e Planos [projetos de arquitetura, desenho urbano, planos de mobilidade, diretores]",,em geral são intervenções no espaço público que visam melhorar o percurso e a qualidade de vida do pedestre de alguma forma. visamos incluir o pedestre como prioridade em nossos projetos como os parklets e o urbanismo caminhável em Jundiaí.,"Participamos do desenvolvimento de projeto de mobiliários, juntamente com a com a prefeitura de São Paulo, para as Praças wi-fi e do detalhamento de mobiliário urbano para a Rua Dom José de Barros. Ambos projetos não foram executados mas se relacionavam, de alguma maneira, com o novo olhar da SMDU para tornar o centro da cidade um local mais de permanência que de passagem, provendo outros tipos de infraestrutura que são importantes para os pedestres.",Acesso a informações,Apoio político,Ausência / escassez de recursos / financiamento,Burocracia / meios legais de atuar,,,,,,Falta de planejamento estratégico,,,,Dados municipais abertos,,,Legislação,"Mídias Sociais (Facebook, Twitter, Medium)",,,,,,,Parceria para pesquisas,Parceria para ações,"Parceria para aprendizagem, capacitação ou treinamento",,Parceria para mobilização e sensibilização,,,"Instituto Mobilidade Verde, Prefeitura de Jundiaí, SMDU SP","cidade ativa, sampapé, apé - estudos em mobilidade",,,2016-04-05 19:29:08,2016-04-05 19:34:39,322aebfa66
576160db89bae44fa204f9086587f9c7,Douglas Roque Andrade,GEPAF - EACH - USP,douglas.andrade@usp.br,http://www.each.usp.br/gepaf/,https://www.facebook.com/gepaf.usp,SP,São Paulo (SP),,"Não, a mobilidade a pé é apenas um dos temas abordados, mas aparece sempre em um contexto mais amplo",2007,Estudar a prática de atividade física em populações,,,,,,,,,Atividade Física,Bairro / comunidade,Cidade,,,,Nacional,,Universidade / grupo de pesquisa,,Universidade / grupo de pesquisa,,Alex Florindo,Masculino,,,Profissional de educação física,Integral,4,10,Remunerados integralmente,,,,,Bolsa de fomento,Convênio (poder público),,,Edital,,,,,,,,,,,,E-mail / mailing / newsletter,Facebook,,,Publicação científica,,,Site,,,,Livros,,Bicicleta [convívio entre mobilidade cicloviária e mobilidade a pé],,"Infraestrutura local [calçadas, cruzamentos, escadarias, passarelas, passagens subterrâneas, travessias, sinalização, mobiliário urbano]",,,,"Saúde e Qualidade de Vida [sedentarismo e doenças relacionadas, como obesidade, diabetes; problemas respiratórios; estresse e depressão]",,,,"Comunicação e Informação [produção e compartilhamento: sites, blogs, grupos de discussão virtual]",,,,,"Pesquisa [diagnóstico, caracterização, indicadores]",,,estudar e intervir nas seguintes áreas: 1) Ambientes saudáveis para a promoção da atividade física; 2) Promoção da atividade física no Sistema Único de Saúde e 3) Redes de promoção da atividade física.,"Apoio, suporte técnico a projetos de pesquisa de outras instituições",,,Ausência / escassez de recursos / financiamento,Burocracia / meios legais de atuar,,,,Falta de colaboradores,,Falta de planejamento estratégico,,,Coleto meus próprios dados em campo,,,"Jornais, Revistas, Sites, Blogs",Legislação,,,Trabalhos acadêmicos,,,,,Parceria para pesquisas,Parceria para ações,,,,,,"Cidade Ativa, Corrida Amiga, CEPEDOC - USP, Instituto Social Esporte Educação, Programa Agita São Paulo",,Cidade Ativa,,2016-04-05 19:34:52,2016-04-05 19:41:40,322aebfa66
